asin,variant_asin,variant,marketplace,brand,product_title,title,body,rating,date,author,verified_purchase,helpful_votes,review_id,review_url,images,scrape_date
B01G4WNA6S,,,amazon.fr,,,Plaques rouges suites à l'administration de ce produit,"Après 1 mois d'utilisation car petites bêtes dans les classes respectives de mes deux filles de 4 et 8 ans depuis la rentrée scolaire.Plaques sur le cuir chevelu qui démangent !!! Déjà que l'odeur était quasi insupportable, mais de là à éloigner les poux et se chopper des plaques rouges, je trouve cela honteux pour un produit destiné à l'enfant.Je ne peux pas mettre 0 étoile mais je suis réellement en colère de ce désagrément.",1,Reviewed in France on 16 November 2025,Ouerfelli Delphine,True,0,R30OAO429DADVD,https://www.amazon.fr/gp/customer-reviews/R30OAO429DADVD,,2026-04-14T14:28:28.996508
B01G4WNA6S,,,amazon.fr,,,Très déçue,Boite endommagé + manque des choses dedans..,1,Reviewed in France on 28 February 2026,Marie d.,True,0,R3HBEWR2QH7MC5,https://www.amazon.fr/gp/customer-reviews/R3HBEWR2QH7MC5,https://m.media-amazon.com/images/I/612zCAtBngL._SY88.jpg; https://m.media-amazon.com/images/I/61zgBTg1DhL._SY88.jpg,2026-04-14T14:28:28.996508
B01G4WNA6S,,,amazon.fr,,,Pratique lorsque le spray n a pas de défaut,,1,Reviewed in France on 29 March 2026,Caroline Cerdeña,True,0,R2PFIMZFOHPFOF,https://www.amazon.fr/gp/customer-reviews/R2PFIMZFOHPFOF,,2026-04-14T14:28:28.996508
B01G4WNA6S,,,amazon.fr,,,Livré sans le bouchon,"J'ai reçu ma commande sans le bouchon, ce qui a entraîné la pulvérisation du produit dans le carton. Par conséquent, une bonne partie du produit manque.",1,Reviewed in France on 21 November 2025,Estrada,True,0,RCYG1LD8GNAFN,https://www.amazon.fr/gp/customer-reviews/RCYG1LD8GNAFN,,2026-04-14T14:28:28.996508
B01G4WNA6S,,,amazon.fr,,,Carton non abîmé.,Bosselé avec odeur de produit !,1,Reviewed in France on 24 November 2025,Lefrant Benoit,True,0,R28TF7R1LSI6A9,https://www.amazon.fr/gp/customer-reviews/R28TF7R1LSI6A9,https://m.media-amazon.com/images/I/61z3pOikYcL._SY88.jpg; https://m.media-amazon.com/images/I/61tYb-H44pL._SY88.jpg,2026-04-14T14:28:28.996508
B01G4WNA6S,,,amazon.fr,,,Nul,"Ne fonctionne pas du tout. Malgré l'application tous les jours, mon fils ramèner toujours des poux... Nul !",1,Reviewed in France on 23 July 2025,Tiffany,True,0,R1HVZL0I46SP22,https://www.amazon.fr/gp/customer-reviews/R1HVZL0I46SP22,,2026-04-14T14:28:28.996508
B01G4WNA6S,,,amazon.fr,,,Défectueux,"Le capuchon pour appuyer et faire sortir le produit ne fonctionne pas et s’en va, il n’y a aucun moyen de faire sortir le produit, il est inutilisable",1,Reviewed in France on 10 February 2025,Lor,True,0,R1DMTZGFMW4Q5Y,https://www.amazon.fr/gp/customer-reviews/R1DMTZGFMW4Q5Y,,2026-04-14T14:28:28.996508
B01G4WNA6S,,,amazon.fr,,,Spray defectueux,"Format familial acheté pour que le produit dure longtemps en prévention.  le spray ne fonctionne pas et envoie de grandes giclées de produit localisé sur un point, qui reçoit donc le produit en surplus.Très décue 😞",1,Reviewed in France on 14 December 2024,MR MATTHIEU LAVIRON,True,0,R17M4YAHAWXYCO,https://www.amazon.fr/gp/customer-reviews/R17M4YAHAWXYCO,,2026-04-14T14:28:28.996508
B01G4WNA6S,,,amazon.fr,,,Produit à moitié vide,Bouchon cassé et le produit a tout coulé,1,Reviewed in France on 19 March 2025,Vm,True,0,R17Y583YJZKVTC,https://www.amazon.fr/gp/customer-reviews/R17Y583YJZKVTC,,2026-04-14T14:28:28.996508
B01G4WNA6S,,,amazon.fr,,,Produit bien mais arrivé abîmé,Le produit est très bien. Sauf qu'il est arrivé sans capuchon et un peu abîméMoyennement satisfaite ...,1,Reviewed in France on 7 March 2023,Tifany,True,0,R1SNRXOJPQMJRZ,https://www.amazon.fr/gp/customer-reviews/R1SNRXOJPQMJRZ,https://m.media-amazon.com/images/I/61NQiZISGJL._SY88.jpg; https://m.media-amazon.com/images/I/61ktfmbYPRL._SY88.jpg,2026-04-14T14:28:28.996508
B01G4WNA6S,,,amazon.fr,,,Ok,Bon répulsif mais sent très fort,2,Reviewed in France on 15 October 2025,Séverine,True,0,R3K7MYL5DIJC3B,https://www.amazon.fr/gp/customer-reviews/R3K7MYL5DIJC3B,,2026-04-14T14:28:28.996508
B01G4WNA6S,,,amazon.fr,,,Inefficace,"Ne marche pas …Malgré des pulvérisations le matin, revient avec des pouxForte odeur",2,Reviewed in France on 30 May 2025,Nico,True,0,R8ZVNIEJFNUKQ,https://www.amazon.fr/gp/customer-reviews/R8ZVNIEJFNUKQ,,2026-04-14T14:28:28.996508
B01G4WNA6S,,,amazon.fr,,,Pas terrible,N'empêche pas les poux d'arriver sur la tête des enfants pourtant cheveux  attaché et spray avant de partir.,2,Reviewed in France on 14 October 2024,NEW ART NUMERIQUE,True,0,RU8EZQ37C3TS1,https://www.amazon.fr/gp/customer-reviews/RU8EZQ37C3TS1,,2026-04-14T14:28:28.996508
B01G4WNA6S,,,amazon.fr,,,Efficace mais mauvaise odeur,Mauvaise odeur,2,Reviewed in France on 23 April 2023,TOUNSI Achraf,True,0,RJS5CPRMBQOXV,https://www.amazon.fr/gp/customer-reviews/RJS5CPRMBQOXV,,2026-04-14T14:28:28.996508
B01G4WNA6S,,,amazon.fr,,,Que cela fonctionne,Produit qui sent trop fort.,2,Reviewed in France on 15 February 2022,Rose,True,0,RLJS4HNFIEPLL,https://www.amazon.fr/gp/customer-reviews/RLJS4HNFIEPLL,,2026-04-14T14:28:28.996508
B01G4WNA6S,,,amazon.fr,,,Odeur forte,"Sens trop fort, odeur très écœurante. Il est peut être efficace car ma fille n'a pas de pou durant de 1er trimestre d'école mais il y a d'autres produits moins fort",2,Reviewed in France on 4 March 2020,Client d'Amazon,True,0,R39LH0WW2IQTYT,https://www.amazon.fr/gp/customer-reviews/R39LH0WW2IQTYT,,2026-04-14T14:28:28.996508
B01G4WNA6S,,,amazon.fr,,,Pas efficace,"Malgré l'utilisation du peigne tous les jours sur mes enfants ainsi que du répulsif mes enfants attrapent quand même des poux, donc pas très efficace",2,Reviewed in France on 30 July 2019,jennifer stoltz,True,3,R1V6VJKFTBZ51P,https://www.amazon.fr/gp/customer-reviews/R1V6VJKFTBZ51P,,2026-04-14T14:28:28.996508
B01G4WNA6S,,,amazon.fr,,,.,"Soit disant produit toxique donc pas de livraison dans les locker. Ok mais moi j'ai reçu le produit dans un carton non ouvert et le produit sans bouchon,donc emballé comme sa et la sa pose pas de problème la toxicité.",3,Reviewed in France on 17 November 2025,Vigneul,True,0,R2Y2LA02ZVEC2I,https://www.amazon.fr/gp/customer-reviews/R2Y2LA02ZVEC2I,,2026-04-14T14:28:28.996508
B01G4WNA6S,,,amazon.fr,,,Aucune utilité,"N’éloigne pas les poux, odeur très présente.Ça ne sert à rien.",3,Reviewed in France on 28 May 2024,lilie1335,True,0,RV4CSTIC9Z125,https://www.amazon.fr/gp/customer-reviews/RV4CSTIC9Z125,,2026-04-14T14:28:28.996508
B01G4WNA6S,,,amazon.fr,,,Désagréable,Premier test pour un dépannage. Odeur très forte pouvant réveiller une Momie égyptienne. Pour l'efficacité à voir dans le temps. Mais je ne retenterai pas l'aventure.,3,Reviewed in France on 30 October 2021,NDONG,True,4,R9M5VR5CE5W33,https://www.amazon.fr/gp/customer-reviews/R9M5VR5CE5W33,,2026-04-14T14:28:28.996508
B01G4WNA6S,,,amazon.fr,,,Bof,Bof,3,Reviewed in France on 24 December 2021,Frédéric vin,True,0,R32S7JR08TX945,https://www.amazon.fr/gp/customer-reviews/R32S7JR08TX945,,2026-04-14T14:28:28.996508
B01G4WNA6S,,,amazon.fr,,,Odore forte,"l'odore è forte, pungente, mi sono fidata perché conoscevo la marca ed altri prodotti sono molto buoni...speriamo che almeno sia efficace",3,Reviewed in Italy on 5 May 2025,Chiara,True,0,R7QYCVVZ4MB4M,https://www.amazon.fr/gp/customer-reviews/R7QYCVVZ4MB4M,,2026-04-14T14:28:28.996508
B01G4WNA6S,,,amazon.fr,,,Il pacco è arrivato integro ma il prodotto è ammaccato. L'erogatore però è funzionante.,,3,Reviewed in Italy on 7 April 2025,Licia,True,0,R2X81T0JX93K7A,https://www.amazon.fr/gp/customer-reviews/R2X81T0JX93K7A,https://m.media-amazon.com/images/I/61wE8cj0VEL._SY88.jpg; https://m.media-amazon.com/images/I/61BTXsDQn5L._SY88.jpg,2026-04-14T14:28:28.996508
B01G4WNA6S,,,amazon.fr,,,Prodotto danneggiato,"Prodotto arrivato danneggiato, per fortuna lo spruzzo funziona ancora.Vediamo se fa il suo dovere...",3,Reviewed in Italy on 20 February 2025,elena g.,True,0,R7NX9P1SP3RYF,https://www.amazon.fr/gp/customer-reviews/R7NX9P1SP3RYF,https://m.media-amazon.com/images/I/61FNUs4TOeL._SY88.jpg,2026-04-14T14:28:28.996508
B01G4WNA6S,,,amazon.fr,,,Prodotto maltrattato,Il pacco era ok ma il prodotto dentro si presentava con varie ammaccature e il tappo completamente rotto,3,Reviewed in Italy on 16 January 2025,Christian,True,0,R11ZVFH3EVQLX4,https://www.amazon.fr/gp/customer-reviews/R11ZVFH3EVQLX4,https://m.media-amazon.com/images/I/713tmrmNzpL._SY88.jpg; https://m.media-amazon.com/images/I/71-3stEpLNL._SY88.jpg; https://m.media-amazon.com/images/I/711MZVrjZqL._SY88.jpg,2026-04-14T14:28:28.996508
B01G4WNA6S,,,amazon.fr,,,Sni,"Profumo delicato, facilissimo l'uso.Tende ad appesantire un po' i capelli a fine giornata.Consiglio per la praticità",3,Reviewed in Italy on 22 October 2024,Paola,True,0,R2SHOXCXYKBM6L,https://www.amazon.fr/gp/customer-reviews/R2SHOXCXYKBM6L,,2026-04-14T14:28:28.996508
B01G4WNA6S,,,amazon.fr,,,Odeur pas trop prononcée,"L’odeur n’est pas trop forte pour des enfants en bas âges ce qui est un plus. Pour le moment, pas de poux dans la tête de ma fille…",4,Reviewed in France on 28 December 2025,André & Coralie,True,0,R3RA3MK1BU0PTC,https://www.amazon.fr/gp/customer-reviews/R3RA3MK1BU0PTC,,2026-04-14T14:28:28.996508
B01G4WNA6S,,,amazon.fr,,,A vour,A voir!,4,Reviewed in France on 2 November 2025,gallimard martine,True,0,R3DX31QKRESDJ2,https://www.amazon.fr/gp/customer-reviews/R3DX31QKRESDJ2,,2026-04-14T14:28:28.996508
B01G4WNA6S,,,amazon.fr,,,Répulsif à poux,Spray anti poux qui semble efficaceOdeur assez prononcé ce qui peut déranger certaines personnes,4,Reviewed in France on 7 May 2024,Guylaine,True,3,RXEAIYX6L34Y5,https://www.amazon.fr/gp/customer-reviews/RXEAIYX6L34Y5,,2026-04-14T14:28:28.996508
B01G4WNA6S,,,amazon.fr,,,Sent fort,Produit qui sent fort mais efficace,4,Reviewed in France on 18 April 2024,Umm Banaati,True,0,R2UBJHNGSNXMGJ,https://www.amazon.fr/gp/customer-reviews/R2UBJHNGSNXMGJ,,2026-04-14T14:28:28.996508
B01G4WNA6S,,,amazon.fr,,,Bon rapport qualité/prix,"Odeur de lavande « industrielle » très intense à l’application mais s’estompe ensuite. Très facile à appliquer. Ne fait pas d’effet gras sur les cheveux. Depuis que ma fille l’utilise, elle n’a pas eu de nouvelles lentes.",4,Reviewed in France on 15 March 2023,Mélanie,True,0,RTL4O6RGITW9Z,https://www.amazon.fr/gp/customer-reviews/RTL4O6RGITW9Z,,2026-04-14T14:28:28.996508
B01G4WNA6S,,,amazon.fr,,,Buono,ha funzionato in più riprese,4,Reviewed in Italy on 19 January 2026,Albe,True,0,R1SXZUC0TK8RRS,https://www.amazon.fr/gp/customer-reviews/R1SXZUC0TK8RRS,,2026-04-14T14:28:28.996508
B01G4WNA6S,,,amazon.fr,,,Spray preventivo,Ha un profumo molto forte che non a tutti può piacere però pare che funzioni,4,Reviewed in Italy on 24 January 2025,Bonetto Daniela,True,0,R2XKRM8S40JDXM,https://www.amazon.fr/gp/customer-reviews/R2XKRM8S40JDXM,,2026-04-14T14:28:28.996508
B01G4WNA6S,,,amazon.fr,,,Spray anti pidocchi,"Prodotto inodore e non unticcio come altri del genere, oltre ad essere naturale al 100% e non chimico. Non c’è il bugiardino in italiano, ma è uno spray facile da applicare.",4,Reviewed in Italy on 23 June 2019,Roby,True,0,R2YQS25Q26E7W6,https://www.amazon.fr/gp/customer-reviews/R2YQS25Q26E7W6,,2026-04-14T14:28:28.996508
B01G4WNA6S,,,amazon.fr,,,Je recommande,"Étant en contact avec quelques ""têtes à poux"", ce répulsif a plutôt bien fonctionné sur moi, puisque je n’en ai pas attrapé. L’odeur n’est pas très agréable et le prix est un peu élevé, mais parfois il vaut mieux investir pour éviter le pire.",5,Reviewed in France on 11 March 2026,meli,True,0,R3J498681FBM0W,https://www.amazon.fr/gp/customer-reviews/R3J498681FBM0W,,2026-04-14T14:28:28.996508
B01G4WNA6S,,,amazon.fr,,,Niquel,Marche super bien en prevention,5,Reviewed in France on 29 January 2026,Magreg,True,0,R2G575IQ7WLDGC,https://www.amazon.fr/gp/customer-reviews/R2G575IQ7WLDGC,,2026-04-14T14:28:28.996508
B01G4WNA6S,,,amazon.fr,,,Efficace mais odeur assez forte au début,"Efficace jusqu’à présent (un mois d’utilisation), je ne m’attendais pas à une odeur si forte mais ce sont des huiles essentielles donc forcément, l’odeur est forte. Cependant, elle se persiste pas dans la journée. Espérons que ce produit nous permette d’échapper aux poux !",5,Reviewed in France on 5 October 2025,Client d'Amazon,True,0,RRR6DK84JVYPM,https://www.amazon.fr/gp/customer-reviews/RRR6DK84JVYPM,,2026-04-14T14:28:28.996508
B01G4WNA6S,,,amazon.fr,,,Je recommande,Je l’utilise à chaque fois que ma fille va a l’écolePour le moment pas de pbs pourtant il y a eu des cas de poux à l’école ( ma fille les attire )Nous sommes très satisfaits et l’odeur reste bien,5,Reviewed in France on 21 January 2026,Laure,True,0,R3QBXRBCQ90UPL,https://www.amazon.fr/gp/customer-reviews/R3QBXRBCQ90UPL,,2026-04-14T14:28:28.996508
B01G4WNA6S,,,amazon.fr,,,Efficace,"On l’utilise depuis deux ans pour éviter d’attraper des poux à l’école, et ça fonctionne, quelques sprays le matin.",5,Reviewed in France on 9 March 2026,Silve,True,0,R19UIYZ2VT684D,https://www.amazon.fr/gp/customer-reviews/R19UIYZ2VT684D,,2026-04-14T14:28:28.996508
B01G4WNA6S,,,amazon.fr,,,Anti poux,Très bon produit et ça marche ça fait des années que je l'achète et pas de poux 👌👌👌,5,Reviewed in France on 14 January 2026,Bibotte,True,0,R2E4BZL9XIWYFQ,https://www.amazon.fr/gp/customer-reviews/R2E4BZL9XIWYFQ,,2026-04-14T14:28:28.996508
B01G4WNA6S,,,amazon.fr,,,Parfait,Produit qui marche très bien très contente,5,Reviewed in France on 27 December 2025,blucyll@live.fr,True,0,R1S6M9L6J8MUHO,https://www.amazon.fr/gp/customer-reviews/R1S6M9L6J8MUHO,,2026-04-14T14:28:28.996508
B01G4WNA6S,,,amazon.fr,,,Conforme à la description,"Impeccable, exactement ce que je cherchais.Parfait comme spray de préventionJ'en mets à ma fille tous les matins avant d'aller à lécole",5,Reviewed in France on 15 October 2025,Client d'Amazon,True,0,R2GFJJYG56Z9CB,https://www.amazon.fr/gp/customer-reviews/R2GFJJYG56Z9CB,,2026-04-14T14:28:28.996508
B01G4WNA6S,,,amazon.fr,,,Top,Super produit,5,Reviewed in France on 22 November 2025,Maud lartigue,True,0,RMFWBC89LBKL6,https://www.amazon.fr/gp/customer-reviews/RMFWBC89LBKL6,,2026-04-14T14:28:28.996508
B01G4WNA6S,,,amazon.fr,,,Ça fonctionne,Pour l'instant ça fonctionne et les enfants n'ont pas attrapé de poux à l'école,5,Reviewed in France on 22 October 2025,OpheD,True,0,R2T8Y25P0CNJH0,https://www.amazon.fr/gp/customer-reviews/R2T8Y25P0CNJH0,,2026-04-14T14:28:28.996508
B01G4WNA6S,,,amazon.fr,,,Top,Le meilleur,5,Reviewed in France on 6 November 2025,Client d'Amazon,True,0,R3C7ZVFLYNGVE0,https://www.amazon.fr/gp/customer-reviews/R3C7ZVFLYNGVE0,,2026-04-14T14:28:28.996508
B01G4WNA6S,,,amazon.fr,,,Sent fort la lavande,Très bien pour compléter  le traitement anti poux,5,Reviewed in France on 30 October 2025,SAHLI Ghizlane,True,0,R3CTB60UC93YPR,https://www.amazon.fr/gp/customer-reviews/R3CTB60UC93YPR,,2026-04-14T14:28:28.996508
