Display Order,Product Details,ASIN,Segment,URL,Image URL,Brand,Price  €,Parent Level Sales,ASIN Sales,Recent Purchases,Parent Level Revenue,ASIN Revenue,Title Char. Count,BSR,Seller Country/Region,Fees  €,Active Sellers,Ratings,Review Count,Images,Review velocity,Buy Box,Category,Size Tier,Fulfillment,Dimensions,Weight,ABA Most Clicked,Creation Date,Sponsored,Best Seller,Seller Age (mo),Seller
58.,"CeraVe Blemish Control Cleanser for Oily Acne-Prone Skin, Purifying Action, Reduced Imperfections, Salicylic Acid and Purifying Clay, 8 oz",B0B7RQ46LD,Check,https://www.amazon.it/dp/B0B7RQ46LD?psc=1,https://m.media-amazon.com/images/I/61aPdjPpDSL._AC_SY355_.jpg,CeraVe,13.19,"17,960","17,960","6,000","201,546.5","201,478.52",138,126,AMZ,6.91,1,4.6,"31,246",8,89,Amazon,Beauty,Large Envelope,AMZ,17.10 x 3.50 x 7.00 cm,0.28,N/A,"Jul 27, 2022",,No,45,Amazon
61.,"Facial Cleansing Foam 473 ml with Ceramides, Niacinamide and Hyaluronic Acid – Hypoallergenic and Fragrance Free for Clean and Hydrated Skin",B07C5XD33D,Check,https://www.amazon.it/dp/B07C5XD33D?psc=1,https://m.media-amazon.com/images/I/61zf6W+qqkL._AC_SY355_.jpg,CeraVe,10.75,"4,055","4,055","2,000","54,903.6","54,862.89",140,45,AMZ,6.18,15,4.7,"53,980",9,705,Amazon,Beauty,Extra Large Envelope,AMZ,18.70 x 4.70 x 8.70 cm,0.54,N/A,"Apr 13, 2018",,No,96,Amazon
64.,"CeraVe Moisturising Cleanser for Normal to Dry Skin, Healthy Skin Barrier, Essential Ceramides, Niacinamide and Hyaluronic Acid, Refill Pack, 473 ml",B0DVLS23YF,Check,https://www.amazon.it/dp/B0DVLS23YF?psc=1,https://m.media-amazon.com/images/I/516fYiEJMdL._AC_SX342_.jpg,CeraVe,11.48,"1,831","1,831",900,"22,735.81","22,727.45",148,234,AMZ,7.05,7,4.5,633,7,58,Amazon,Beauty,Small Parcel,AMZ,18.40 x 6.50 x 13.70 cm,0.5,N/A,"Mar 18, 2025",,No,13,Amazon
68.,BIODERMA Atoderm Soap Free Shower Gel – Gentle Cleanser for Normal to Dry Skin – Prescribed by Dermatologists – Pump Bottle 1 Litre,B0089WNKVC,Wash,https://www.amazon.it/dp/B0089WNKVC?psc=1,https://m.media-amazon.com/images/I/61ODZOqDVWL._AC_SY355_.jpg,Bioderma,18.55,182,162,100,"3,176.55","2,878.8",131,"3,579",IT,7.78,41,4.6,"10,475",8,141,ArrowBrands,Beauty,Small Parcel,FBA,21.70 x 7.40 x 10.30 cm,1.09,N/A,"Aug 14, 2012",,No,164,ArrowBrands
69.,"Amidomio Euphidra Bathroom Gentle Cleansing Cream, 400 ml",B01NAGK5QV,Check,https://www.amazon.it/dp/B01NAGK5QV?psc=1,https://m.media-amazon.com/images/I/616+er5C26L._AC_SY355_.jpg,Euphidra,9.2,744,744,400,"3,907.87","3,903.66",57,"1,640",AMZ,5.39,18,4.8,"1,092",7,4,Amazon,Beauty,Small Parcel,AMZ,17.20 x 6.40 x 9.30 cm,0.47,N/A,"Dec 7, 2016",,No,112,Amazon
71.,"CeraVe Cleansing Foam, Face & Body Foam, Normal to Oily Skin, Impurity Free Skin, Strengthened Skin Barrier with Essential Ceramides, Hyaluronic Acid and Niacinamide, 545ml",B0CRSJ46YD,Wash,https://www.amazon.it/dp/B0CRSJ46YD?psc=1,https://m.media-amazon.com/images/I/71xO5T86AKL._AC_SX342_.jpg,CeraVe,16.62,770,770,400,"13,980.3","13,978.87",172,518,AMZ,6.66,1,4.7,"2,496",6,63,Amazon,Beauty,Extra Large Envelope,AMZ,21.20 x 4.60 x 9.20 cm,0.65,N/A,"Jan 8, 2024",,No,27,Amazon
73.,"Sxhyf Cleaning Brushes - Household Cleaning Brush, Multifunctional Gap Cleaning Brush, Cleaning Tools for Home, Kitchen, Bathroom, Window (Black)",B0CN3185T8,Check,https://www.amazon.it/dp/B0CN3185T8?psc=1,https://m.media-amazon.com/images/I/51k4UHjonkL._AC_SY355_.jpg,SXhyf,9.82,"1,856","1,291","1,000","20,751.73","14,450.42",145,98,CN,4.34,1,4.4,"21,152",8,400,SXhyf-IT,Home & Kitchen,Standard Envelope,FBA,25.10 x 1.40 x 10.49 cm,0.12,N/A,"Dec 21, 2023",Sponsored Brand Video,No,28,SXhyf-IT
32.,Dermovitamina Sensioil 200 ml – Gentle Shower Oil – Sensitive Skin Washing Oil – High Tolerability – Makeup Remover and Soothing Action – Skin Softness – For The Whole Family,B0DJH3JW92,Wash,https://www.amazon.it/dp/B0DJH3JW92?psc=1,https://m.media-amazon.com/images/I/61TZlTI7dTL._AC_SY355_.jpg,Dermovitamina,10.9,"1,248",104,50,"21,683.75","1,039.32",174,670,AMZ,4.38,5,4.6,639,8,21,Amazon,Beauty,Extra Large Envelope,AMZ,16.70 x 4.20 x 4.20 cm,0.23,N/A,"Oct 4, 2024",,No,18,Amazon
35.,"Aveeno Dermexa Daily Emollient Shower Bath, Soothing Body Wash Without Soap and Fragrance, Shower Gel with Oats and Ceramides, Shower Gel for Very Dry, Sensitive and Irritated Skin, 300 ml",B08D6T94FS,Wash,https://www.amazon.it/dp/B08D6T94FS?psc=1,https://m.media-amazon.com/images/I/6184jX5ffML._AC_SY355_.jpg,Aveeno,13.61,115,102,50,"1,881.8","1,528.87",188,"6,396",IT,7.68,9,4.6,271,8,N/A,FARMACIA ONLINE SHOP,Beauty,Extra Large Envelope,FBA,18.80 x 5.20 x 8.50 cm,0.37,N/A,"Jul 16, 2020",,No,69,FARMACIA ONLINE SHOP
37.,"Aveeno Skin Relief Bath Shower, Soothing Body Wash Without Soap and Fragrance, Triple Oat Complex Shower Foam, Daily Shower for Very Dry and Sensitive Skin, 500ml",B07Y4DH4M6,Wash,https://www.amazon.it/dp/B07Y4DH4M6?psc=1,https://m.media-amazon.com/images/I/61I+fCbCp0L._AC_SY355_.jpg,Aveeno,10.32,"1,538",179,100,"18,940.14","2,907.64",162,697,AMZ,7.71,15,4.6,461,7,N/A,Amazon,Beauty,Small Parcel,AMZ,17.80 x 6.10 x 8.80 cm,0.71,N/A,"Sep 20, 2019",,No,79,Amazon
50.,"La Roche-Posay Dual Action Foaming Cleansing Gel, Suitable for Sensitive Skin, Eliminates Impurities and Sebum, Soft and Hydrated Skin, Formula with Delicate Surfactants and Glycerin, Toleriane, 400",B01LTGM28G,Wash,https://www.amazon.it/dp/B01LTGM28G?psc=1,https://m.media-amazon.com/images/I/51loYjQCrIL._AC_SX342_.jpg,La Roche-Posay,14.09,140,140,N/A,"2,340.65","2,340.21",198,"7,410",N/A,6.28,1,4.6,"4,531",10,86,,Beauty,Extra Large Envelope,FBA,19.90 x 5.90 x 14.50 cm,0.53,N/A,"Sep 19, 2016",,No,115,
53.,"Eucerin pH5 Fluid Cleanser Refill 400 ml, Gentle and Moisturizing Face and Body Cleanser Refill for Frequent Washes, Soap Free Body Wash for the Whole Family for Dry and Sensitive Skin",B0C42JYL9V,Check,https://www.amazon.it/dp/B0C42JYL9V?psc=1,https://m.media-amazon.com/images/I/71s8NvT7DsL._AC_SY355_.jpg,Eucerin,13.9,138,138,50,"1,175.63","1,174.97",184,"3,481",AMZ,5.56,5,4.5,82,7,10,Amazon,Beauty,Small Parcel,AMZ,20.60 x 6.20 x 11.80 cm,0.44,N/A,"May 4, 2023",,No,35,Amazon
64.,"Biopoint - Soothing Bath Cream, Gentle Shower Cleanser with Nourishing Action, with Silk Protein and Peony Extract, Gives a Soft and Scented Skin, 400 ml",B01N9RAW2B,Check,https://www.amazon.it/dp/B01N9RAW2B?psc=1,https://m.media-amazon.com/images/I/71bgZy4ZB4L._AC_SY355_.jpg,BIOPOINT,7.5,507,459,200,"3,081.27","2,699.62",153,"2,543",AMZ,N/A,10,4.3,471,3,8,Amazon,Beauty,Small Parcel,AMZ,19.90 x 6.40 x 9.60 cm,0.47,N/A,"Jan 13, 2017",,No,111,Amazon
66.,Bionike Triderm - Doccia Schiuma,B00D3HZV4C,Check,https://www.amazon.it/dp/B00D3HZV4C?psc=1,https://m.media-amazon.com/images/I/61loKg0-ecL._AC_SY445_.jpg,BioNike,5.21,145,145,50,"1,432.13","1,430.55",32,"5,919",AMZ,4.38,2,4.6,152,5,2,Amazon,,Extra Large Envelope,AMZ,15.40 x 4.50 x 4.60 cm,0.24,N/A,"Sep 12, 2014",,No,139,Amazon
68.,"Bionike Triderm - Sapone Liquido di Marsiglia per Pelli Sensibili e Intolleranti, Detergente per Lavaggi Frequenti ad Azione Protettiva e Idratante, Dona Morbidezza alla Pelle",B00D3HTOEK,Check,https://www.amazon.it/dp/B00D3HTOEK?psc=1,https://m.media-amazon.com/images/I/61o-gLkqxXL._AC_SX342_.jpg,BioNike,6.95,"1,066","1,066",500,"16,147.86","16,144.68",175,652,AMZ,7.32,15,4.6,"1,718",5,15,,Beauty,Small Parcel,AMZ,21.20 x 6.30 x 6.40 cm,0.57,N/A,"Feb 5, 2014",,No,146,
73.,"SXhyf Hard Bristle Corner Cleaning Brush - Grout Cleaning Brush, Hard Bristle Cleaning Brush, Corner Cleaning Brush (2, Black)",B0F12NRW5G,Check,https://www.amazon.it/dp/B0F12NRW5G?psc=1,https://m.media-amazon.com/images/I/61GNcOJytiL._AC_SY355_.jpg,SXhyf,8.19,90,90,N/A,"1,076.85","1,075.84",126,"8,294",CN,4.2,1,4.4,41,6,9,SXhyf-IT,Home & Kitchen,Standard Envelope,FBA,23.40 x 1.40 x 6.40 cm,0.04,N/A,"Mar 11, 2025",Sponsored Brand Video,No,13,SXhyf-IT
39.,"Uriage 25% Glycerin Cleansing Oil - 2 in 1: Gently Cleanses and Moisturises - Foaming Shower Oil for the Whole Family - Face & Body - Soap-Free, Physiological PH, Sensitive Skin",B06Y3NWF7D,Wash,https://www.amazon.it/dp/B06Y3NWF7D?psc=1,https://m.media-amazon.com/images/I/61zJxHQ8tjL._AC_SY355_.jpg,Uriage,15.66,"1,159",128,50,"18,254.48","1,948.21",177,649,IT,7.63,22,4.6,"5,693",7,124,Scientia Naturae,Beauty,Small Parcel,MFN,22.20 x 8.30 x 10.50 cm,0.6,N/A,"Jul 17, 2017",,No,105,Scientia Naturae
52.,"Moisturizing Foaming Cleansing Oil 236 ml for Face and Body - Cleanses and Moisturizes without Drying the Skin, Suitable for All Skin Types",B09CCJD53W,Check,https://www.amazon.it/dp/B09CCJD53W?psc=1,https://m.media-amazon.com/images/I/5161IiNwbgL._AC_SX342_.jpg,CeraVe,7.92,684,684,300,"7,874.09","7,869.93",139,"1,059",AMZ,4.13,14,4.7,"4,038",9,76,Amazon,Beauty,Large Envelope,AMZ,17.10 x 3.40 x 6.90 cm,0.28,N/A,"Sep 6, 2021",,No,55,Amazon
54.,Ist.ganassini Vitamindermina Cleansing Oil 750 ml,B0CBMKJN9R,Check,https://www.amazon.it/dp/B0CBMKJN9R?psc=1,https://m.media-amazon.com/images/I/51fQUlUqKOL._AC_SY355_.jpg,Vidermina,20,86,86,50,"1,491.62","1,491.3",49,"12,357",IT,7.6,12,4.8,95,1,0,GIODICARTONLINE,Beauty,Small Parcel,MFN,24.10 x 6.80 x 6.90 cm,0.89,N/A,"Jul 11, 2023",,No,33,GIODICARTONLINE
55.,"Bioderm Plus Antibacterial Dermodetergent Enriched with Thyme and Tea Tree Oil 500 ml – Intimate Cleanser – Gentle for the Body for Adults, the Elderly, Incontinent and Disabled",B08DGB3LGZ,Check,https://www.amazon.it/dp/B08DGB3LGZ?psc=1,https://m.media-amazon.com/images/I/61scSgKGv9L._AC_SY355_.jpg,BIODERM BIODERMOCOSMETICI,8.98,"1,614",636,300,"21,997.64","8,004.44",177,613,AMZ,6.73,1,4.5,"1,285",8,13,Amazon,Health & Household,Small Parcel,AMZ,18.70 x 6.70 x 6.90 cm,0.52,N/A,"May 12, 2017",,No,107,Amazon
57.,"Beauty of Joseon Ginseng Cleansing Oil (210ml, 7.1fl.oz.)",B0B45M89LX,Check,https://www.amazon.it/dp/B0B45M89LX?psc=1,https://m.media-amazon.com/images/I/61ZWA0m2RVL._AC_SY355_.jpg,Beauty of Joseon,20.86,95,95,N/A,"1,760.46","1,759.52",57,"3,868",N/A,7.3,8,4.5,"3,247",6,56,,Beauty,Extra Large Envelope,FBA,18.90 x 5.20 x 5.30 cm,0.26,N/A,"Sep 20, 2023",,No,31,
59.,Ceramol Facial Body Cleansing Oil 400 ml,B0BHJLWCWD,Check,https://www.amazon.it/dp/B0BHJLWCWD?psc=1,https://m.media-amazon.com/images/I/41maHOoNOuL._AC_SY355_.jpg,One Farmacia,20.77,285,285,100,"5,851.09","5,849.36",40,"3,204",IT,7.02,8,4.8,74,1,5,Di Prima Farmacia,Beauty,Extra Large Envelope,MFN,18.80 x 4.50 x 8.30 cm,0.44,N/A,"Apr 23, 2024",,No,24,Di Prima Farmacia
67.,"Atoderm Washing Oil | Immediate Hydration and Comfort | Intensively Nourishes | Cleans, Relipid and Soothes Irritations | Excellent Tolerance | Made in France | Pack of 2 x 1 Litre",B0CXTMQ54T,Check,https://www.amazon.it/dp/B0CXTMQ54T?psc=1,"https://m.media-amazon.com/images/I/71NCI03jdgL._AC_SY355_PIbundle-2,TopRight,0,0_SH20_.jpg",PARAVOSTRA,39.86,85,85,N/A,"2,726.84","2,725.9",180,"9,130",IT,9.84,3,4.6,139,2,9,Farmacia Gaudiana,Beauty,Small Parcel,FBA,22.00 x 7.90 x 21.30 cm,2.35,N/A,"Mar 20, 2024",,No,25,Farmacia Gaudiana
70.,"La Roche-Posay Lipikar Cleansing Oil, for Sensitive Skin, Anti-Redness, Ultra-Hydration, Formula with Aqua Posae Filiformis, Shea Butter, Niacinamide, AP+, 750 ml",B07NPVNYZM,Wash,https://www.amazon.it/dp/B07NPVNYZM?psc=1,https://m.media-amazon.com/images/I/71OFKMJU5CL._AC_SX342_.jpg,La Roche-Posay,27.58,47,47,N/A,"1,287.11","1,286.5",162,"15,192",N/A,9.09,1,4.7,981,1,18,,Beauty,Small Parcel,MFN,21.90 x 7.70 x 7.70 cm,0.87,N/A,"Jan 27, 2019",,No,87,
73.,"Minismus Shower Squeegee - Window and Door Glass Cleaner - Silicone Shower Squeegee - Shower Glass, Bathroom and Mirrors Cleaner - Without Drilling, Holder Included (Black, 21 cm)",B09QH14TB3,Check,https://www.amazon.it/dp/B09QH14TB3?psc=1,https://m.media-amazon.com/images/I/51fDMtHhuYL._AC_SY355_.jpg,Minismus,14.01,"1,681",590,300,"29,841.94","10,016.61",179,177,NL,5.56,5,4.5,"4,000",7,136,Kranis B.V.,Home & Kitchen,Large Envelope,FBA,22.21 x 3.20 x 20.66 cm,0.21,N/A,"Jan 14, 2022",Sponsored Brand Video,No,51,Kranis B.V.
31.,"La Roche-Posay Lipikar Foaming Cleansing Bread, for Dry Skin, Soothing and Moisturizing, Cleansed and Soft Skin Without Dryness, with Niacinamide and Shea Butter, Surgras, 150 g",B000V3O8NQ,Wash,https://www.amazon.it/dp/B000V3O8NQ?psc=1,https://m.media-amazon.com/images/I/51p6JwVCxvL._AC_SX342_.jpg,La Roche-Posay,6.1,189,189,100,"1,256.93","1,256.55",177,"4,102",AMZ,3.84,1,4.6,"1,962",1,45,Amazon,Beauty,Large Envelope,AMZ,10.10 x 3.90 x 6.90 cm,0.13,N/A,"May 3, 2012",,No,167,Amazon
53.,"Sebamed Liquid, without soap, cleanses without irritating, suitable for sensitive skin, respects the physiological acidity of the skin, leaves the skin soft and elastic, suitable for face and body,",B0872GJJ7D,Check,https://www.amazon.it/dp/B0872GJJ7D?psc=1,https://m.media-amazon.com/images/I/61DcFYs8TPL._AC_SY355_.jpg,Sebamed,5.66,748,153,50,"11,694.8","1,054.52",197,"1,287",AMZ,4.05,1,4.7,565,7,8,Amazon,Beauty,Extra Large Envelope,AMZ,14.00 x 4.40 x 8.70 cm,0.25,N/A,"Apr 13, 2020",,No,72,Amazon
54.,Cetaphil Daily Facial Cleanser 473 ml,B0CDXXGBK4,Check,https://www.amazon.it/dp/B0CDXXGBK4?psc=1,https://m.media-amazon.com/images/I/71veFvGuC-L._AC_SY445_.jpg,Cetaphil,10.47,645,645,200,"8,201.28","8,200.97",37,"1,986",AMZ,7.13,9,4.6,378,6,8,Amazon,Beauty,Extra Large Envelope,AMZ,19.00 x 5.40 x 9.80 cm,0.54,N/A,"Dec 15, 2023",,No,28,Amazon
56.,Cetaphil Daily Facial Cleanser 236 ml,B0CDXZ9W53,Check,https://www.amazon.it/dp/B0CDXZ9W53?psc=1,https://m.media-amazon.com/images/I/61UrLhBOrhL._AC_SX342_.jpg,Cetaphil,5.31,"1,840","1,840",700,"11,920.39","11,920.22",37,692,AMZ,4.11,12,4.4,680,6,35,Amazon,Beauty,Extra Large Envelope,AMZ,18.70 x 5.30 x 8.90 cm,0.29,N/A,"Dec 15, 2023",,No,28,Amazon
59.,ISDIN Ureadin Hydrating Shower Gel (400 ml) | Daily Use Gel with 5% Urea | Cleanses and Moisturizes the Skin | Recommended for Dry Skin,B00JJQPWMC,Check,https://www.amazon.it/dp/B00JJQPWMC?psc=1,https://m.media-amazon.com/images/I/51DKImlSf-L._AC_SX342_.jpg,ISDIN,11.52,129,129,50,"1,855.4","1,853.99",135,"7,664",AMZ,6.34,4,4.4,351,7,7,Amazon,Beauty,Extra Large Envelope,AMZ,21.80 x 5.10 x 6.70 cm,0.49,N/A,"Apr 8, 2014",,No,144,Amazon
60.,"Bionike Triderm Marseille Liquid Soap for Sensitive and Intolerant Skin, Gentle Cleanser with Protective and Moisturizing Action, Gives Softness",B00D3HVW2W,Check,https://www.amazon.it/dp/B00D3HVW2W?psc=1,https://m.media-amazon.com/images/I/61AqW7vYHIL._AC_SY355_.jpg,BioNike,4.52,668,544,200,"7,000.66","3,942.28",144,"2,171",AMZ,4.38,8,4.5,"1,118",7,5,,Beauty,Extra Large Envelope,AMZ,17.00 x 5.20 x 5.30 cm,0.3,N/A,"Apr 23, 2014",,No,144,
62.,"BioNike Triderm - Gel Doccia Delicato Corpo e Capelli, per la Detersione Quotidiana di Cute e Cuoio Capelluto, pH Fisiologico, Indicato per Pelli Sensibili, Adatto a Tutta la Famiglia",B0D6BH6LQM,Other,https://www.amazon.it/dp/B0D6BH6LQM?psc=1,https://m.media-amazon.com/images/I/51IGi7gvSOL._AC_SX342_.jpg,BioNike,17.9,211,175,100,"2,900.43","2,481.08",183,"4,369",AMZ,7.33,9,4.5,35,5,2,Amazon,Beauty,Small Parcel,AMZ,21.30 x 7.70 x 7.80 cm,0.84,N/A,"Jun 6, 2024",,No,22,Amazon
64.,La Roche Posay Toleriane Cleansing Care 400ml,B01N7T7JKJ,Check,https://www.amazon.it/dp/B01N7T7JKJ?psc=1,https://m.media-amazon.com/images/I/610TMlEvi4L._AC_SX342_.jpg,La Roche-Posay,18.99,314,314,200,"6,240.46","6,237.51",45,"1,208",AMZ,8.01,1,4.6,"36,879",1,372,Amazon,Beauty,Extra Large Envelope,AMZ,20.05 x 5.89 x 5.89 cm,0.45,N/A,"Jan 24, 2017",,No,111,Amazon
73.,"Moller's | Omega 3 Cod Liver Oil | Omega-3 Dietary Supplements with EPA, DHA, Vitamins A, D and E | Superior Taste Award | 166 Years Existing Brand | Lemon | 500ml",B0CBT3S3CS,Check,https://www.amazon.it/dp/B0CBT3S3CS?psc=1,https://m.media-amazon.com/images/I/71N6LSx33DL._AC_SY355_.jpg,MÖLLER'S,24.82,"1,185",636,200,"31,743.03","17,358.3",163,"1,290",SE,10.03,1,4.7,"3,410",9,N/A,Orkla,Health & Household,Small Parcel,FBA,25.10 x 6.60 x 19.40 cm,0.87,N/A,"Jul 13, 2023",Sponsored Brand Video,No,33,Orkla
1.,L'amande - L'Amande Marseille Scented Sweet Almond Oil for Soft Skin 250 ml - 902197882,B07R91ZV2R,Check,https://www.amazon.it/dp/B07R91ZV2R?psc=1,https://m.media-amazon.com/images/I/61JljpG5cML._AC_SY355_.jpg,L'Amande,13.89,743,322,100,"9,388.93","3,388.96",87,"2,371",IT,6.61,2,4.6,415,5,N/A,Lui & Lei BEAUTY®,Beauty,Extra Large Envelope,FBA,16.80 x 6.00 x 6.30 cm,0.27,N/A,"Apr 30, 2019",Sponsored Brand,No,84,Lui & Lei BEAUTY®
3.,"L'AMANDE - 100% Natural Rosehip Oil with Vitamin E, Body Oil and Hair Delicate Fresh and Blooming, Toning and Anti-Aging Action, Ideal for Massage Mature or Young Skin, 250 ml",B07T2WLCGX,Other,https://www.amazon.it/dp/B07T2WLCGX?psc=1,https://m.media-amazon.com/images/I/61g0dFs9uML._AC_SY355_.jpg,L'Amande,9.14,743,273,100,"9,388.93","3,662.78",175,"2,371",AMZ,N/A,7,4.7,237,7,N/A,,Beauty,Extra Large Envelope,AMZ,16.60 x 5.90 x 6.10 cm,0.27,N/A,"Jun 15, 2019",Sponsored Brand,No,82,
17.,"Bio-Oil Gel Treatment with Moisturizing Action, Intense and Duration, Suitable for Dry Skin, Hides Scars, Stretch Marks and Blemishes, 200 ml",B07KNCW934,Check,https://www.amazon.it/dp/B07KNCW934?psc=1,https://m.media-amazon.com/images/I/81c6ZS3ElyL._AC_SY355_.jpg,Bio-Oil,20.99,"1,047","1,047",400,"14,791.19","14,786.33",141,"1,241",AMZ,7.5,1,4.5,"1,712",3,21,Amazon,Beauty,Small Parcel,AMZ,8.20 x 6.10 x 6.10 cm,0.21,N/A,"Nov 16, 2018",,No,89,Amazon
36.,"Equilibra Pure Almond Oil, Sweet Almond Oil, Protective, Nourishing and Elasticizing, Helps Prevent Stretch Marks in Pregnancy or During a Low Calorie Diet, 250ml",B0FHW77PXF,Check,https://www.amazon.it/dp/B0FHW77PXF?psc=1,https://m.media-amazon.com/images/I/51AbNE3XCGL._AC_SY355_.jpg,Equilibra,6.9,"1,648",632,200,"14,638.27","3,363.09",162,426,AMZ,3.59,1,4.6,"8,002",4,20,Amazon,Beauty,Extra Large Envelope,AMZ,13.00 x 5.50 x 5.50 cm,0.26,N/A,"Jul 17, 2025",,No,9,Amazon
37.,"Goovi Elastic is Fantastic Body Oil with a Mix of 6 Precious Oils, Nourishes and Makes the Skin Elastic, Prevents Stretch Marks, 140 ml",B08QMFHBFV,Check,https://www.amazon.it/dp/B08QMFHBFV?psc=1,https://m.media-amazon.com/images/I/51WuvN7ZpoL._AC_SY355_.jpg,GOOVI,16.9,169,169,100,"2,112.07","2,110.22",135,"5,470",AMZ,5.82,12,4.4,118,5,0,Amazon,Beauty,Large Envelope,AMZ,17.40 x 4.00 x 4.10 cm,0.16,N/A,"Nov 21, 2020",,No,65,Amazon
39.,Nuxe Huile Prodigieuse Multifunction Dry Oil - 100 ml,B01ATJESD6,Check,https://www.amazon.it/dp/B01ATJESD6?psc=1,https://m.media-amazon.com/images/I/717rtVq0aeL._AC_SY355_.jpg,Nuxe,31.9,"1,689","1,294",600,"41,972.61","31,254.73",53,506,IT,7.61,39,4.7,"13,332",8,27,CorpoeCapelli,Beauty,Large Envelope,MFN,15.80 x 3.90 x 8.80 cm,0.26,N/A,"Apr 5, 2014",,No,144,CorpoeCapelli
56.,Palmer's Cocoa Butter Moisturizing Body Oil Formula,B000056W74,Check,https://www.amazon.it/dp/B000056W74?psc=1,https://m.media-amazon.com/images/I/81bde6fUI3L._AC_SY355_.jpg,Palmer's,11.47,88,80,N/A,"1,321.74","1,091.14",51,"12,491",N/A,6.04,13,4.6,"26,319",7,267,TATA1111,Beauty,Large Envelope,FBA,19.60 x 3.70 x 6.10 cm,0.27,N/A,"Feb 11, 2016",,No,122,TATA1111
60.,"Helan, W Oud Hair Oil, Face and Body, Scented and Brightening, for Silky and Soft Skin and Head of Hair, Fast Absorption - Moisturizing Dry Body Oil with Linen, Sweet Almonds and Vitamin E, 50 ml",B08LWNH3B6,Other,https://www.amazon.it/dp/B08LWNH3B6?psc=1,https://m.media-amazon.com/images/I/81tuL9Kcb-L._AC_SY355_.jpg,Helan,10.39,96,70,N/A,"1,511.69","1,062.17",195,"11,449",AMZ,6.74,8,4.3,267,5,N/A,,Beauty,Large Envelope,AMZ,13.60 x 2.90 x 5.20 cm,0.19,N/A,"Oct 20, 2020",,No,66,
61.,"Marco Viti - Vitamin E Oil Spray, 125 ml, Regenerating and Antioxidant Action, Protection for Dry and Sensitive Skin, Oil for Massage and Stretch Marks, Moisturizing and Nourishing, Easy Application",B0F18V6R4G,Check,https://www.amazon.it/dp/B0F18V6R4G?psc=1,https://m.media-amazon.com/images/I/61zx5raRLDL._AC_SY355_.jpg,Marco Viti,10.57,84,84,50,"1,084.56","1,083.6",198,"10,894",AMZ,6.11,9,4.1,11,7,0,Amazon,Health & Household,Extra Large Envelope,AMZ,19.20 x 4.70 x 4.80 cm,0.14,N/A,"Mar 12, 2025",,No,13,Amazon
62.,"Bioderm Vitamin E Complex Oil Spray - Nourishing and Soothing Oil with Vitamin E | Antioxidant Moisturizer for Dry, Sensitive or Irritated Skin | Face and Body Use (125ml)",B0749NKH29,Check,https://www.amazon.it/dp/B0749NKH29?psc=1,https://m.media-amazon.com/images/I/611uDSi37vL._AC_SY355_.jpg,BIODERM BIODERMOCOSMETICI,14.58,78,78,N/A,"1,194.72","1,194.32",171,"9,934",AMZ,6.58,1,4.5,7,7,2,Amazon,Beauty,Extra Large Envelope,AMZ,17.10 x 4.30 x 4.40 cm,0.16,N/A,"Nov 17, 2018",,No,89,Amazon
63.,"Kanzy Pure Cold Pressed Jojoba Oil 120 ml - Unrefined Jojoba Oil for Face, Body, Hair, Scalp and Beard",B07BYPW7LZ,Other,https://www.amazon.it/dp/B07BYPW7LZ?psc=1,https://m.media-amazon.com/images/I/71KUbTeCjJL._AC_SX355_.jpg,KANZY,11.99,"7,417",754,400,"70,139.35","8,192.85",102,28,GB,5.13,1,4.4,"40,709",9,660,KANZY,Beauty,Extra Large Envelope,FBA,13.90 x 5.05 x 5.10 cm,0.23,N/A,"Apr 7, 2018",,No,96,KANZY
65.,"LILLYDOO ALMOND OIL - Fragrance Free - 100% Natural Origin - Vegan - in a High Quality Glass Bottle (100ml) Dermatologically Tested and Rated ""Excellent"" by Medical Specialists",B0DRW6RH9H,Check,https://www.amazon.it/dp/B0DRW6RH9H?psc=1,https://m.media-amazon.com/images/I/71RbLHm-EsL._AC_SY355_.jpg,LILLYDOO,8.2,318,318,200,"3,178.23","3,178.08",176,"2,189",AMZ,4.38,1,4.8,175,6,8,Amazon,Beauty,Extra Large Envelope,AMZ,14.60 x 4.90 x 5.10 cm,0.25,N/A,"Dec 30, 2024",,No,16,Amazon
69.,"Bio-Oil Natural Skin Care Oil for Stretch Marks, Scars, Dry Skin & Skin Spots 200ml, Pack of 1",B093HQF5GR,Check,https://www.amazon.it/dp/B093HQF5GR?psc=1,https://m.media-amazon.com/images/I/61Sbd+dYucL._AC_SY355_.jpg,Bio-Oil,34.99,321,321,100,"7,460.96","7,458.68",94,"3,143",AMZ,7.65,1,4.5,"1,325",10,5,Amazon,Beauty,Extra Large Envelope,AMZ,17.50 x 4.90 x 5.00 cm,0.23,N/A,"Apr 19, 2021",,No,60,Amazon
15.,P.O.L. CALM liporestitutivo emollient fluid 200 ml,B08TH3XBV8,Check,https://www.amazon.it/dp/B08TH3XBV8?psc=1,https://m.media-amazon.com/images/I/61NNkJzkB3L._AC_SX355_.jpg,DIFA COOPER,18.9,455,455,200,"6,418.81","6,417.43",50,"2,037",AMZ,4.17,15,4.6,185,1,3,Amazon,Beauty,Extra Large Envelope,AMZ,18.30 x 5.70 x 5.80 cm,0.24,N/A,"Jan 16, 2021",,No,63,Amazon
16.,"AIESI Hydrophilic Base Cream (1 kg), Restructuring Moisturizing Cream for Face and Body Ideal for Dry Skin, Pharmaceutical, Cosmetic and Dermatological Use, Made in Italy",B07NGWHVC1,Cream,https://www.amazon.it/dp/B07NGWHVC1?psc=1,https://m.media-amazon.com/images/I/71qFla6j2wL._AC_SY355_.jpg,AIESI,13.85,321,321,100,"5,430.7","5,427.36",170,"3,011",AMZ,9.03,3,4.5,780,7,7,Amazon,Beauty,Small Parcel,AMZ,15.30 x 9.70 x 10.00 cm,1.06,N/A,"Feb 6, 2019",,No,86,Amazon
27.,"Helan, Bio Baby Line, Soothing Cream, Moisturizing Face and Body, for Delicate and Sensitive Skin, Enriched with Aloe Vera and Vitamin E - 100 ml - Made in Italy",B01M4N7JDN,Check,https://www.amazon.it/dp/B01M4N7JDN?psc=1,https://m.media-amazon.com/images/I/71Be9CaUyTL._AC_SY355_.jpg,Helan,9.7,219,219,100,"2,554.12","2,553.83",161,"1,025",AMZ,5.37,17,4.6,358,8,5,Amazon,Baby Products,Extra Large Envelope,AMZ,16.21 x 4.90 x 5.11 cm,0.13,N/A,"Apr 25, 2016",,No,120,Amazon
28.,Marco Viti - Marco Viti Hyaluronic Plus Regenerating and Emollient Cream 25 g - 949970661,B0DXQYMWP1,Check,https://www.amazon.it/dp/B0DXQYMWP1?psc=1,https://m.media-amazon.com/images/I/617+uPOkzaL._AC_SY355_.jpg,Marco Viti,10,"5,139","3,842","2,000","44,205.33","30,361.71",89,333,N/A,3.45,8,4.6,100,7,N/A,Amazon,Beauty,Standard Envelope,FBA,15.80 x 2.10 x 4.40 cm,0.03,N/A,"Feb 19, 2025",,No,14,Amazon
33.,Ducray Ictyane Emollient Nourishing Face & Body Cream 2 x 200ml,B07Y8W1QQT,Check,https://www.amazon.it/dp/B07Y8W1QQT?psc=1,"https://m.media-amazon.com/images/I/51FBYVkWEqL._AC_SY355_PIbundle-2,TopRight,0,0_SH20_.jpg",Ducray,19.37,130,130,50,"3,114.91","3,113.45",63,"8,055",FR,7.76,3,4.9,53,2,4,Para Prestige,Beauty,Extra Large Envelope,FBA,20.10 x 5.30 x 15.30 cm,0.44,N/A,"Sep 3, 2019",,No,79,Para Prestige
34.,Dexeryl Emollient Cream 250g,B00E5A3H88,Cream,https://www.amazon.it/dp/B00E5A3H88?psc=1,https://m.media-amazon.com/images/I/51DJte9WwBL._AC_SY355_.jpg,DEXERYL,13.93,146,146,50,"1,983.99","1,983.41",28,"6,481",IT,5.31,10,4.7,588,2,22,Di Prima Farmacia,Beauty,Extra Large Envelope,FBA,20.50 x 5.40 x 6.80 cm,0.29,N/A,"Jun 28, 2016",,No,118,Di Prima Farmacia
35.,"Rilastil Face and Body Cream, Scar Treatment, Soothing and Moisturizer for Sensitive Skin, 200 ml",B08ZKBWQ5F,Check,https://www.amazon.it/dp/B08ZKBWQ5F?psc=1,https://m.media-amazon.com/images/I/61YqqMaWkWL._AC_SX342_.jpg,Rilastil,16.54,"1,034","1,034",500,"23,770.2","23,765.91",97,710,AMZ,7.44,29,4.6,"1,096",4,21,Amazon,Beauty,Extra Large Envelope,AMZ,18.50 x 4.90 x 17.80 cm,0.24,N/A,"Mar 20, 2021",,No,61,Amazon
37.,"NIVEA Soft Multi-Purpose Cream, 1 x 300 ml, Moisturising and Refreshing Cream, Face, Body, and Hand Cream, Quick Absorption, Enriched with Vitamin E and Jojoba Oil",B0BDSPDNDT,Check,https://www.amazon.it/dp/B0BDSPDNDT?psc=1,https://m.media-amazon.com/images/I/71t3QRrFJmL._AC_SY355_.jpg,NIVEA,6.29,"1,127","1,127",600,"4,692.12","4,690.37",163,794,AMZ,4.91,17,4.7,619,6,26,Amazon,Beauty,Extra Large Envelope,AMZ,9.80 x 5.90 x 9.50 cm,0.33,N/A,"Sep 9, 2022",,No,43,Amazon
40.,"CeraVe Crema Idratante Viso e Corpo, Per Pelli da Secche a Molto Secche, Azione Protettiva e Ripristino della Barriera Cutanea, Con 3 Ceramidi e Acido Ialuronico + Routine Correlate a Questo Prodotto",B0CBKWWHY9,Check,https://www.amazon.it/dp/B0CBKWWHY9?psc=1,https://m.media-amazon.com/images/I/61JLqdUCEyL._AC_SX342_.jpg,CeraVe,24.32,"1,417",709,100,"30,679.28","17,226.88",199,636,AMZ,8.6,1,4.6,"4,760",1,N/A,Amazon,Beauty,Small Parcel,AMZ,10.40 x 9.20 x 9.50 cm,0.6,N/A,"Aug 21, 2023",,No,32,Amazon
