asin,variant_asin,variant,marketplace,brand,product_title,title,body,rating,date,author,verified_purchase,helpful_votes,review_id,review_url,images,scrape_date
B00HFDGMNO,,,amazon.fr,,,Je m'interrogeais en fonction des évaluations négatives,"C'est vraiment le top pour moi. Les guêpes et frelons (asiatiques et européens) capturés par centaines en quelques jours seulement. Il est vrai que les 2 pièges souffrent de 2 déficits: la contenance du liquide attractif est insuffisante et la fragilité de fermeture des 2 capots peut engendrer des accidents lorsqu'on descend les pièges de leur branche lorsqu'ils sont remplis par les insectes dont certains sont encore vivants , mais le bénéfice est très important, mouches,guêpes et frelons sont réellement absorbés par centaines et ...pas une abeille !Attention toutefois le liquide de l'appât est très important.",4,Reviewed in France on 28 August 2018,Bourguignon,True,24,R3L9E9GK788MS,https://www.amazon.fr/gp/customer-reviews/R3L9E9GK788MS,,2026-04-28T18:11:46.888852
B00HFDGMNO,,,amazon.fr,,,Frelons asiatique,"Mis en place dans un arbre fruitier car cette année nous étions en concurrence avec des frelons , fais le job guêpes mouches et frelons asiatique entrent mais ne ressortent plus",4,Reviewed in France on 20 August 2023,Éric,True,3,R22DRE9G142T6E,https://www.amazon.fr/gp/customer-reviews/R22DRE9G142T6E,,2026-04-28T18:11:46.888852
B00HFDGMNO,,,amazon.fr,,,Produit correct et conforme à la description,"Produit conforme à la description, fonctionne bien mais capacité un peu faible donc nécessite un maintenance fréquente en saison.",4,Reviewed in France on 12 January 2024,Client d'Amazon,True,2,R2CO820A1TOX10,https://www.amazon.fr/gp/customer-reviews/R2CO820A1TOX10,,2026-04-28T18:11:46.888852
B00HFDGMNO,,,amazon.fr,,,Très bon vendeur !,"Produit conforme à la description du vendeur. Je ne l’ai pas encore essayé mais pour avoir eu un autre modèle que celui-ci je ne doute pas de ses performances pour attraper les guêpes, frelon asiatiques. Je vais faire un mélange spécial de manière à ce que les abeilles ne soient pas prises au piège. Je recommande ce vendeur pour son sérieux qui envoie un mail pour s’assurer de la bonne livraison et de la satisfaction du client. Merci",4,Reviewed in France on 6 August 2020,NATHALIE LINA,True,0,R2ICTXVZ13H75S,https://www.amazon.fr/gp/customer-reviews/R2ICTXVZ13H75S,,2026-04-28T18:11:46.888852
B00HFDGMNO,,,amazon.fr,,,un des  recipient  est sans couverle,n'en ayant pas eu besoin avant ce jour a l ouverture de la boite il manque un  couvercle,4,Reviewed in France on 28 August 2023,levreau jacques,True,0,R1JGCRN1SGTEIY,https://www.amazon.fr/gp/customer-reviews/R1JGCRN1SGTEIY,,2026-04-28T18:11:46.888852
B00HFDGMNO,,,amazon.fr,,,Parfait,Utilisé pour capturer des frelons asiatiques.Ils sont parfaits et ça fonctionne très très bien  Le seul souci que je verrai c est le vieillissement dans  le temps car les plastiques semblent avoir un peu de jeu au niveau de l’assemblage et donc à ne pas manipuler comme un bourdon .Mais bon vu le prix on ne demande pas que ça tienne 10 ans.,4,Reviewed in France on 16 October 2018,Dominique M Paris,True,0,R3A8ZL2ZKN8Y8V,https://www.amazon.fr/gp/customer-reviews/R3A8ZL2ZKN8Y8V,,2026-04-28T18:11:46.888852
B00HFDGMNO,,,amazon.fr,,,Moyen,Pas beaucoup d'insectes piegés mais semble leur faire peur donc c'est efficace lol,4,Reviewed in France on 20 July 2023,Dupont,True,0,RV04QFTRCAYNN,https://www.amazon.fr/gp/customer-reviews/RV04QFTRCAYNN,,2026-04-28T18:11:46.888852
B00HFDGMNO,,,amazon.fr,,,Redoutable efficacité,Piège à guêpes et autres insectes volants. Nous avons même eu la surprise de piéger de nombreux frelons.Pièges victimes de leur succès car il fallait changer le liquide chaque jour.Prix plutôt élevé à l'achat mais c'était la condition pour les recevoir rapidement.Nous avons retrouvé la sérénité des repas dehors sans attaque de guêpes et autres...,4,Reviewed in France on 22 October 2020,flo-jp,True,0,R32CR17Q7J7D2O,https://www.amazon.fr/gp/customer-reviews/R32CR17Q7J7D2O,,2026-04-28T18:11:46.888852
B00HFDGMNO,,,amazon.fr,,,Efficace,"Un peu de bière, quelques gouttes de sirop de grenadine et le piège est opérationnel. En, à peu près, 2 heures, j'ai piégé 4 frelons asiatiques de belle taille. A conseiller.",4,Reviewed in France on 13 May 2022,ppmchl33,True,0,R3FP3IE738QSS0,https://www.amazon.fr/gp/customer-reviews/R3FP3IE738QSS0,,2026-04-28T18:11:46.888852
B00HFDGMNO,,,amazon.fr,,,ça marche,"rien à dire. j'ai déjà piégé pas mal de frelons avec ces pièges et donc ils remplissent leur mission. le seul inconvénient : une fois les pièges remplis avec le liquide, si vous les déplacez, les pièges fuient par les trous de passage des insectes mais bon ce n'est pas bien grave",4,Reviewed in France on 9 October 2020,barrocat,True,0,RQQCGL5L6U0TH,https://www.amazon.fr/gp/customer-reviews/RQQCGL5L6U0TH,,2026-04-28T18:11:46.888852
B00HFDGMNO,,,amazon.fr,,,répond à la fonction demandée,"ok, très bel emballage pour des pièges à guêpes!répond à la fonction demandée. Le plus : il donne la recette à mettre dans les pièges.J'avais lu dans les commentaires qu'il peut y avoir des fuites, c'est le cas seulement si l'on met trop de liquide et dépasse une certaine hauteur.",4,Reviewed in France on 3 September 2020,Pierre,True,0,R1091E5TFWU4QT,https://www.amazon.fr/gp/customer-reviews/R1091E5TFWU4QT,,2026-04-28T18:11:46.888852
B00HFDGMNO,,,amazon.fr,,,Conforme,Conforme à l’annonce,4,Reviewed in France on 1 November 2023,maguiwood,True,0,R2FCPNEAJW64RQ,https://www.amazon.fr/gp/customer-reviews/R2FCPNEAJW64RQ,,2026-04-28T18:11:46.888852
B00HFDGMNO,,,amazon.fr,,,Parfait pour les guêpes un peu petit pour frelon,Avec une bonne recette attrape guêpes parfait. Contenant un peu petit trop rapidement vide mais fait le travail.Satisfait de mon achat,4,Reviewed in France on 7 September 2022,Barbe,True,0,R1LCRL4KXRYFD,https://www.amazon.fr/gp/customer-reviews/R1LCRL4KXRYFD,,2026-04-28T18:11:46.888852
B00HFDGMNO,,,amazon.fr,,,Piège à guêpes très efficace,,4,Reviewed in France on 13 August 2020,Fourmarier Bernard,True,3,R6858T5N7AUUK,https://www.amazon.fr/gp/customer-reviews/R6858T5N7AUUK,,2026-04-28T18:11:46.888852
B00HFDGMNO,,,amazon.fr,,,satisfait,"Pour l'instant , tout se passe bien.",4,Reviewed in France on 1 May 2023,L'espagnol,True,0,RGJS83V9T7N8D,https://www.amazon.fr/gp/customer-reviews/RGJS83V9T7N8D,,2026-04-28T18:11:46.888852
B00HFDGMNO,,,amazon.fr,,,RENDEMEMENT,"Pour le moment, à part attraper des mouches et des fourmis. Pas très attirant pour les guêpes. A voir dans le temps.",4,Reviewed in France on 24 June 2022,PAT,True,0,R14C2S0B0BB6E6,https://www.amazon.fr/gp/customer-reviews/R14C2S0B0BB6E6,,2026-04-28T18:11:46.888852
B00HFDGMNO,,,amazon.fr,,,Efficace mais capacité/autonomie limitée,"Le système fonctionne bien, les guêpes rentrent et ne ressortent pas, dans l'ensemble. Cependant, l'autonomie de fonctionnement est limité par le volume de liquide (servant attirer les guêpes) qu'il peut contenir et qui s'évapore rapidement par forte chaleur. Cela nécessite de le remplir souvent...",4,Reviewed in France on 30 August 2020,J. Michel,True,0,R31D29HFM7SPTM,https://www.amazon.fr/gp/customer-reviews/R31D29HFM7SPTM,,2026-04-28T18:11:46.888852
B00HFDGMNO,,,amazon.fr,,,Pas mal !,"Ce piège à insectes est efficace contre les guêpes, mouches à m... etc. Tout dépend du mélange que vous préparez ! Sucre, eau, et j’en passe. Une recette peut être trouvée sur internet. Sinon vous mettez le mélange vendu par Amazon. Aussi efficace. Le plus pénible : vider le liquide et les insectes morts.",4,Reviewed in France on 18 June 2018,PatFra,True,0,R1TCP4EHSPD2PP,https://www.amazon.fr/gp/customer-reviews/R1TCP4EHSPD2PP,,2026-04-28T18:11:46.888852
B00HFDGMNO,,,amazon.fr,,,"déja acheté les mêmes en magasin , tres efficaces...mais...","juste le capuchon blanc un peu dur à visser dessus....si mal vissé le piège tombe et se casse(en plastique)  , c'est comme cela que j'en ai cassé un , sinon très efficace : la couleur jaune attire les bestioles de loin , après le pres les guepes ou frelons sentent le produit dedans... moi je mets du sirop de pêche ....",4,Reviewed in France on 27 March 2017,jerome,True,0,R352EZXOLT78UN,https://www.amazon.fr/gp/customer-reviews/R352EZXOLT78UN,,2026-04-28T18:11:46.888852
B00HFDGMNO,,,amazon.fr,,,Efficace,"A déjà fait son oeuvre en capturant les premières guêpes et frelons certainement des mères qui ne pondront plus .......à suspendre dans un buisson en fleur et surtout dans votre mélange sucré y adjoindre un peu de VIN BLANC , pour éloigner les abeilles ...",4,Reviewed in France on 25 April 2019,Denis SESNIAC,True,0,R34D3F0A5150GU,https://www.amazon.fr/gp/customer-reviews/R34D3F0A5150GU,https://m.media-amazon.com/images/I/81R2sgC9hWL._SY88.jpg; https://m.media-amazon.com/images/I/81R2sgC9hWL._SY88.jpg,2026-04-28T18:11:46.888852
B00HFDGMNO,,,amazon.fr,,,Diablement efficace!,"Fonctionne très bien!Attention de ne pas mettre trop de liquides (eau, jus de fruits, vinaigre) pour éviter que le nivuea de liquide soit trop haut dans l'appareil.Selon l'environnement, nécessite d'être nettoyé et rempli tous les jours..",4,Reviewed in France on 12 August 2020,JLM,True,0,R3FGC6S21RE91K,https://www.amazon.fr/gp/customer-reviews/R3FGC6S21RE91K,,2026-04-28T18:11:46.888852
B00HFDGMNO,,,amazon.fr,,,je n'ai pas eu le temps de le mettre en place,"à l'ouverture du colis, j'ai eu une bonne surprise générale, la facture m'a l'air solide, une attente cependant sur la couvercle qui se visse et qui tient l'ensemble de l'objet une fois suspendu, je ne l'ai pas encore mis en place pourl'essayer.",4,Reviewed in France on 24 May 2019,19jpr57,True,0,R1FI1AWUT83RAK,https://www.amazon.fr/gp/customer-reviews/R1FI1AWUT83RAK,,2026-04-28T18:11:46.888852
B00HFDGMNO,,,amazon.fr,,,Manque d’explication,Dommage on ne comprend pas très bien comment ça marche ... faut-il mettre du produit ? Si oui quoi? Comment ? Combien ?,4,Reviewed in France on 10 November 2021,Nini,True,0,R3E7FWWLF6ZRLO,https://www.amazon.fr/gp/customer-reviews/R3E7FWWLF6ZRLO,,2026-04-28T18:11:46.888852
B00HFDGMNO,,,amazon.fr,,,BON ARTICLE,Bon piège pour les guêpes mais pas pour les frelons asiatiques qui sont trop gros pour rentrer .Le fond mériterait d'être un peu plus haut pour mettre d'avantage de liquide.,4,Reviewed in France on 18 November 2020,JASMINE,True,0,R1BPRP5TSLT7MH,https://www.amazon.fr/gp/customer-reviews/R1BPRP5TSLT7MH,,2026-04-28T18:11:46.888852
B00HFDGMNO,,,amazon.fr,,,Marche,"Dégoutant à nettoyer, mais efficace. Ces trappes ont attrapé des centaines de guêpes et frelons en un rien de temps = petit prix sans produits chimique qui fonctionne.",4,Reviewed in France on 17 December 2020,leelewadee,True,0,R11W738NWMGSC,https://www.amazon.fr/gp/customer-reviews/R11W738NWMGSC,,2026-04-28T18:11:46.888852
B00HFDGMNO,,,amazon.fr,,,Redoutable...,"Redoutablement efficace conte les frelons, les guêpes et les mouches!Pour ma part, j'ai opté pour un vin doux sucré et en une heure, j'avais déjà des client(e)s... et l'alcool éloigne les abeilles, donc c'est bien!",4,Reviewed in France on 26 July 2019,Véronique Chazal,True,0,R1W57MY1LQBCSU,https://www.amazon.fr/gp/customer-reviews/R1W57MY1LQBCSU,,2026-04-28T18:11:46.888852
B00HFDGMNO,,,amazon.fr,,,"L ' Efficacité qui est au rendez-vous , mais  cher p / ce que c'est  !","Pour attraper  guêpes ,mouches et frelons, il est très  efficace  , mais  cher !",4,Reviewed in France on 21 December 2021,serge grinberg,True,0,R1H6W4FZF3R9UI,https://www.amazon.fr/gp/customer-reviews/R1H6W4FZF3R9UI,,2026-04-28T18:11:46.888852
B00HFDGMNO,,,amazon.fr,,,Très efficace,Ce piège marche très bien pour les frelons!,4,Reviewed in France on 25 June 2022,Mille,True,0,R1ROCPGHSF42QV,https://www.amazon.fr/gp/customer-reviews/R1ROCPGHSF42QV,,2026-04-28T18:11:46.888852
B00HFDGMNO,,,amazon.fr,,,piege à guêpes,"invasion de guêpes .Produit efficace mais le prix est trop élévé, le m^me produit se trouve à centrakkor à 2,49 l'unité soit 3 fois moins cher .",4,Reviewed in France on 28 August 2020,vienne evelyne,True,0,R1MB61B9LZ549M,https://www.amazon.fr/gp/customer-reviews/R1MB61B9LZ549M,,2026-04-28T18:11:46.888852
B00HFDGMNO,,,amazon.fr,,,Bon produit efficace,"Bon produit. Ils fonctionnent parfaitement. Seul bémol, in ne peut pas mettre beaucoup de mélange dedans. Donc il faut les nettoyer souvent.",4,Reviewed in France on 29 June 2021,Mlle Giscard Claire,True,0,R3VPR9KGFIA9RW,https://www.amazon.fr/gp/customer-reviews/R3VPR9KGFIA9RW,,2026-04-28T18:11:46.888852
B00HFDGMNO,,,amazon.fr,,,Je trouve ça très bien,"Je l'utilise pour l'extérieur pour les guêpes, les mouches, sa fonctionne super bien nous sommes tranquille et pouvons manger à l'extérieur sans que l'on soit embêté",4,Reviewed in France on 16 August 2020,Client d'Amazon,True,0,R2EWNWPJ0HF4BF,https://www.amazon.fr/gp/customer-reviews/R2EWNWPJ0HF4BF,https://m.media-amazon.com/images/I/71BE8YGPeKL._SY88.jpg; https://m.media-amazon.com/images/I/71BE8YGPeKL._SY88.jpg; https://m.media-amazon.com/images/I/71mXZJH5EML._SY88.jpg; https://m.media-amazon.com/images/I/71mXZJH5EML._SY88.jpg,2026-04-28T18:11:46.888852
B00HFDGMNO,,,amazon.fr,,,PIEGE A GUEPES,LE PRODUIT EST CONFORME. DELAIS DE LIVRAISON RESPECTES. JE NE L'AI PAS ENCORE TESTE CAR PAS DE GUEPES POUR LE MOMENT,4,Reviewed in France on 18 June 2021,MC,True,0,R2QI1UL8SWAEAP,https://www.amazon.fr/gp/customer-reviews/R2QI1UL8SWAEAP,,2026-04-28T18:11:46.888852
B00HFDGMNO,,,amazon.fr,,,Un été sauvé,"On nous avait dit grand bien de ce type de pièges, je confirme.Nous étions vraiment envahis de guêpes surtout cet été, et quelques frelons.Ces pièges, avec un peu de sirop, d'eau, et de vinaigre, ont fait le ménage vite fait.Parfait.",4,Reviewed in France on 17 September 2017,HankyMan,True,0,R2V0CEAH9W3T19,https://www.amazon.fr/gp/customer-reviews/R2V0CEAH9W3T19,,2026-04-28T18:11:46.888852
B00HFDGMNO,,,amazon.fr,,,Un piège efficace,C’est solide esthétique et très efficace,4,Reviewed in France on 5 June 2022,JULESYLVE,True,0,R120WIGZFGPLHE,https://www.amazon.fr/gp/customer-reviews/R120WIGZFGPLHE,,2026-04-28T18:11:46.888852
B00HFDGMNO,,,amazon.fr,,,Efficacité de ce produit,Piège pour insecte très performant; mais la capacité du réservoir est faible et il faut renouveler au quotidien le liquidesucré,4,Reviewed in France on 23 August 2020,Alain Kehren,True,0,RHMMMEHIFI11,https://www.amazon.fr/gp/customer-reviews/RHMMMEHIFI11,,2026-04-28T18:11:46.888852
B00HFDGMNO,,,amazon.fr,,,au top,fonctionne tres bien piege les guêpe et les frelon. avec un mélange maison biere grenadine et vinaigre aucun nuisibles ne résiste,4,Reviewed in France on 11 August 2020,baptiste,True,0,R2IGLURFE7UKZJ,https://www.amazon.fr/gp/customer-reviews/R2IGLURFE7UKZJ,,2026-04-28T18:11:46.888852
B00HFDGMNO,,,amazon.fr,,,Piège,Bien utile dans certaines occasions et très bon rapport qualité  prix,4,Reviewed in France on 21 August 2021,Bruce,True,0,R2RWFQN0BOE24C,https://www.amazon.fr/gp/customer-reviews/R2RWFQN0BOE24C,,2026-04-28T18:11:46.888852
B00HFDGMNO,,,amazon.fr,,,efficacité pas évidente,"j'ai essayé plusieurs melanges de sirops, c'est pas evident de trouver la bonne formule. ce piège attrappe davantage de mouches que de guêpes.",4,Reviewed in France on 20 October 2019,Client Amazon,True,0,R1Q0K8AP0SDV7E,https://www.amazon.fr/gp/customer-reviews/R1Q0K8AP0SDV7E,,2026-04-28T18:11:46.888852
B00HFDGMNO,,,amazon.fr,,,Top,"Bonne solution naturelle, on prépare le cocktail avant de commencer le babecue.Du coup, on est plus dérangé dans le jardin. Je conseille",4,Reviewed in France on 8 September 2019,Leone,True,0,R1UQWPHKJU94R2,https://www.amazon.fr/gp/customer-reviews/R1UQWPHKJU94R2,,2026-04-28T18:11:46.888852
B00HFDGMNO,,,amazon.fr,,,Piège qui fonctionne !,Efficace si on dose bien la préparation. Je recommande ce produit qui est conforme à mes attentes,4,Reviewed in France on 16 August 2020,Client d'Amazon,True,0,RUXNHLI4BPT9F,https://www.amazon.fr/gp/customer-reviews/RUXNHLI4BPT9F,,2026-04-28T18:11:46.888852
B00HFDGMNO,,,amazon.fr,,,Très bien pour petites guêpes,Trou d’entrée trop petit pour frelons asiatiques,4,Reviewed in France on 12 December 2021,Alain,True,0,R2DQEBSU98ABMB,https://www.amazon.fr/gp/customer-reviews/R2DQEBSU98ABMB,,2026-04-28T18:11:46.888852
B00HFDGMNO,,,amazon.fr,,,Satisfait,"J'ai mis une quantité plus importante de sirop de grenadine que d'eau. J'ai attrapé des guêpes, mais une c'est échapper. C'est pas bien grave.Qualité du produit très bien.",4,Reviewed in France on 2 May 2018,Laura,True,0,R25XAHRKNFH28I,https://www.amazon.fr/gp/customer-reviews/R25XAHRKNFH28I,,2026-04-28T18:11:46.888852
B00HFDGMNO,,,amazon.fr,,,Bien,La capacité du produits que l'on met est assez réduit sinon fait son boulot,4,Reviewed in France on 15 September 2020,Sergio490,True,0,R1F4SVGJCJ6UHB,https://www.amazon.fr/gp/customer-reviews/R1F4SVGJCJ6UHB,,2026-04-28T18:11:46.888852
B00HFDGMNO,,,amazon.fr,,,Bon produit,Résultats inespérés mais gagnerait à être un peu plus volumineux.,4,Reviewed in France on 20 November 2020,Michelys,True,0,R30RH56LTYX9PR,https://www.amazon.fr/gp/customer-reviews/R30RH56LTYX9PR,,2026-04-28T18:11:46.888852
B00HFDGMNO,,,amazon.fr,,,Piège,"À première vue le produit a l’air assez résistant, avoir dans le temps y’a plus qu’à attendre des résultats",4,Reviewed in France on 4 April 2019,Chrys,True,0,RH84UA7PK2TOK,https://www.amazon.fr/gp/customer-reviews/RH84UA7PK2TOK,https://images-na.ssl-images-amazon.com/images/G/01/x-locale/common/grey-pixel.gif; https://m.media-amazon.com/images/I/71evv09NuRL._SY88.jpg,2026-04-28T18:11:46.888852
B00HFDGMNO,,,amazon.fr,,,dommage pour elles !,"mis sur ma terrasse à bonne distance ,avec un peu de confiture dedans c'est le drame assuré !",4,Reviewed in France on 13 March 2019,corine tillement,True,0,R2KSLJWK4ZDNTS,https://www.amazon.fr/gp/customer-reviews/R2KSLJWK4ZDNTS,,2026-04-28T18:11:46.888852
B00HFDGMNO,,,amazon.fr,,,tres bon produit,J'ai déjà installé ce produit et il me donne entièrement satisfaction.J'envisage d'en acheter d'autres,4,Reviewed in France on 7 July 2019,GALIBERT Henri Bernard,True,0,RZTVHVXKJTU76,https://www.amazon.fr/gp/customer-reviews/RZTVHVXKJTU76,,2026-04-28T18:11:46.888852
B00HFDGMNO,,,amazon.fr,,,impeccable,c'est impeccable juste un bémol cela marche tellement bien qu'il est vite plein de guêpes car le fond qui contient l'appât n'est pas assez grand,4,Reviewed in France on 12 November 2017,idefix,True,0,R2KSBY49REU1V0,https://www.amazon.fr/gp/customer-reviews/R2KSBY49REU1V0,,2026-04-28T18:11:46.888852
B00HFDGMNO,,,amazon.fr,,,Efficace et élégant,"J’ai déjà acheté le produit l’an passé, et satisfait l’ai racheté cette année",4,Reviewed in France on 17 July 2019,Jean-luc C.,True,0,R3SG4TWC88CCQE,https://www.amazon.fr/gp/customer-reviews/R3SG4TWC88CCQE,,2026-04-28T18:11:46.888852
B00HFDGMNO,,,amazon.fr,,,Produit commander conforme,Produit conforme,4,Reviewed in France on 28 January 2021,olivier,True,0,R1HITT6ZGPML5X,https://www.amazon.fr/gp/customer-reviews/R1HITT6ZGPML5X,,2026-04-28T18:11:46.888852
B00HFDGMNO,,,amazon.fr,,,un libérateur,en cours d utilisation.Avoir dans  quelques jours sur  frelons asiatiques,4,Reviewed in France on 11 May 2019,DESMAREST,True,0,R10968J5U52P0V,https://www.amazon.fr/gp/customer-reviews/R10968J5U52P0V,,2026-04-28T18:11:46.888852
B00HFDGMNO,,,amazon.fr,,,Impeccable,Marche très bien,4,Reviewed in France on 25 August 2020,severinebernard,True,0,R1WCQ52VKI6NFJ,https://www.amazon.fr/gp/customer-reviews/R1WCQ52VKI6NFJ,,2026-04-28T18:11:46.888852
B00HFDGMNO,,,amazon.fr,,,Attention attire aussi des insectes comme l'abeille domestique,J'ai achetez cet ustensile pour attraper guèpes et frelons,4,Reviewed in France on 5 August 2019,Georges 68,True,0,R2N5U4U92DKN0Z,https://www.amazon.fr/gp/customer-reviews/R2N5U4U92DKN0Z,,2026-04-28T18:11:46.888852
B00HFDGMNO,,,amazon.fr,,,Bien,Vraiment bien,4,Reviewed in France on 28 August 2020,sandy54,True,0,R3PA6MS8X1JDUU,https://www.amazon.fr/gp/customer-reviews/R3PA6MS8X1JDUU,,2026-04-28T18:11:46.888852
B00HFDGMNO,,,amazon.fr,,,ok,bon fonctionnement,4,Reviewed in France on 20 August 2020,renaud,True,0,R18NPDXY8A9PP0,https://www.amazon.fr/gp/customer-reviews/R18NPDXY8A9PP0,,2026-04-28T18:11:46.888852
B00HFDGMNO,,,amazon.fr,,,Super efficace,Super efficace,4,Reviewed in France on 17 August 2020,Eric RENIER,True,0,RBRKJL5U7JL41,https://www.amazon.fr/gp/customer-reviews/RBRKJL5U7JL41,,2026-04-28T18:11:46.888852
B00HFDGMNO,,,amazon.fr,,,le jus à préparer est une réussite,simple mise en place.un point qui n'est pas éclairci : comment nettoyer cet appareil???,4,Reviewed in France on 29 August 2018,prirou,True,0,RJWMASYX6EWX9,https://www.amazon.fr/gp/customer-reviews/RJWMASYX6EWX9,,2026-04-28T18:11:46.888852
B00HFDGMNO,,,amazon.fr,,,Bien,Bien mais pas assez de réserve de mélange,4,Reviewed in France on 22 July 2019,Client d'Amazon,True,0,R33N606V5EIFPE,https://www.amazon.fr/gp/customer-reviews/R33N606V5EIFPE,,2026-04-28T18:11:46.888852
B00HFDGMNO,,,amazon.fr,,,Bien,Bien,4,Reviewed in France on 1 September 2020,Cherley bodnar,True,0,R2V9Q923K9FWKL,https://www.amazon.fr/gp/customer-reviews/R2V9Q923K9FWKL,,2026-04-28T18:11:46.888852
B00HFDGMNO,,,amazon.fr,,,Ok,Ok,4,Reviewed in France on 30 August 2020,jerome frederick,True,0,R3IS585X77RW2B,https://www.amazon.fr/gp/customer-reviews/R3IS585X77RW2B,,2026-04-28T18:11:46.888852
B00HFDGMNO,,,amazon.fr,,,Bien,Ras,4,Reviewed in France on 10 June 2020,gilles lehr,True,0,R2N96LDTY2F8F1,https://www.amazon.fr/gp/customer-reviews/R2N96LDTY2F8F1,,2026-04-28T18:11:46.888852
B00HFDGMNO,,,amazon.fr,,,Conforme à mes attentes,"Paraît solide, à vérifier avec le temps",4,Reviewed in France on 24 May 2019,Drjekyll,True,0,R2OILSKOTO6NZK,https://www.amazon.fr/gp/customer-reviews/R2OILSKOTO6NZK,,2026-04-28T18:11:46.888852
B00HFDGMNO,,,amazon.fr,,,Conforme à l’annonce,Conforme à l’annonce,4,Reviewed in France on 20 October 2019,Thomas GROS,True,0,RNTDHR1J0LBVX,https://www.amazon.fr/gp/customer-reviews/RNTDHR1J0LBVX,,2026-04-28T18:11:46.888852
B00HFDGMNO,,,amazon.fr,,,produit correspondant à l annonce,bon rapport qualite prix,4,Reviewed in France on 21 July 2019,damienldfl,True,0,R2KJHG8AUF1W08,https://www.amazon.fr/gp/customer-reviews/R2KJHG8AUF1W08,,2026-04-28T18:11:46.888852
B00HFDGMNO,,,amazon.fr,,,Bien et pas cher,Contre les frelons asiatiques,4,Reviewed in France on 4 May 2019,TISSIER Olivier,True,0,RXVYOICEI97KX,https://www.amazon.fr/gp/customer-reviews/RXVYOICEI97KX,,2026-04-28T18:11:46.888852
B00HFDGMNO,,,amazon.fr,,,Good,Bon produit,4,Reviewed in France on 10 August 2019,boumediene ali,True,0,RXL8R77A59BAL,https://www.amazon.fr/gp/customer-reviews/RXL8R77A59BAL,,2026-04-28T18:11:46.888852
B00HFDGMNO,,,amazon.fr,,,Bon,Piège pratique,4,Reviewed in France on 18 October 2018,DMY Isa,True,0,R2OG0SHS8JVRSS,https://www.amazon.fr/gp/customer-reviews/R2OG0SHS8JVRSS,,2026-04-28T18:11:46.888852
B00HFDGMNO,,,amazon.fr,,,FAIS LE JOB,EFFICACE MAIS JE CRAINS CES BESTIOLES ET NE VEUT NI LES VOIR NI LES RAMASSER,4,Reviewed in France on 16 June 2025,vero,False,0,RDNJ26FFJZ8I8,https://www.amazon.fr/gp/customer-reviews/RDNJ26FFJZ8I8,,2026-04-28T18:11:46.888852
B00HFDGMNO,,,amazon.fr,,,Article petit,Top mais attention c est petit,4,Reviewed in France on 24 March 2025,Superbe produit. Très bien taillé.,False,0,R1UM54353Y2KN7,https://www.amazon.fr/gp/customer-reviews/R1UM54353Y2KN7,,2026-04-28T18:11:46.888852
B00HFDGMNO,,,amazon.fr,,,Fonctionne parfaitement bien avec de la bière brune et sirop de grenadine...,Pour attraper les guêpes et frelons !,4,Reviewed in France on 12 August 2019,Alexandre DENIS,False,0,R1KJAWG24RGQCV,https://www.amazon.fr/gp/customer-reviews/R1KJAWG24RGQCV,,2026-04-28T18:11:46.888852
B00HFDGMNO,,,amazon.fr,,,Efficace mais ne pas trop remplir. Un peu cher cependant pour du plastique,"Efficace et aspect esthétique.Mais un peu cher!Attention à ne pas trop remplir, sinon debordement. Quand sur la notice  on parle de petits verres  il faut traduire...verres à liqueur!Efficace sur guêpes et frelons",4,Reviewed in France on 13 June 2021,etifier,True,0,R30YNM8KC4J07G,https://www.amazon.fr/gp/customer-reviews/R30YNM8KC4J07G,,2026-04-28T18:11:46.888852
B00HFDGMNO,,,amazon.fr,,,Satisfait,Satisfait,4,Reviewed in France on 1 November 2019,yannovsky,True,0,R1FETH0VDWT00I,https://www.amazon.fr/gp/customer-reviews/R1FETH0VDWT00I,,2026-04-28T18:11:46.888852
B00HFDGMNO,,,amazon.fr,,,Efficacité,"Un des plus efficace du marché, 1/4 fruit rouge et 3/4 bière blonde et le résultat est redoutable !",5,Reviewed in France on 23 April 2026,g wandewinckelle,True,0,RKFMC42ZO0SBT,https://www.amazon.fr/gp/customer-reviews/RKFMC42ZO0SBT,,2026-04-28T18:11:46.888852
B00HFDGMNO,,,amazon.fr,,,Super,Très pratique et fonctionnel,5,Reviewed in France on 18 April 2026,Philippe sondaz,True,0,R1W48P76K7DRRY,https://www.amazon.fr/gp/customer-reviews/R1W48P76K7DRRY,,2026-04-28T18:11:46.888852
B00HFDGMNO,,,amazon.fr,,,Capture les guêpes,Fonctionne très bien en deux jours pas mal de guêpes piégées pour les frelons je verrais en espérant ne pas en avoir,5,Reviewed in France on 4 March 2026,aveant katya,True,2,RT5C3O5OYXJ60,https://www.amazon.fr/gp/customer-reviews/RT5C3O5OYXJ60,https://m.media-amazon.com/images/I/71WV3oth6sL._SY88.jpg,2026-04-28T18:11:46.888852
B00HFDGMNO,,,amazon.fr,,,Piège à frelon,"Excellent ; devrait équiper obligatoirement tous les endroits susceptibles d’attirer le frelon, insecte redoutable pour l’abeille et pour l’homme, qui n’a pas de prédateur, et pendant qu’il en est pas trop tard",5,Reviewed in France on 21 February 2026,Eugen3,True,3,R2UHF2LTVBTFG,https://www.amazon.fr/gp/customer-reviews/R2UHF2LTVBTFG,,2026-04-28T18:11:46.888852
