Product Details,ASIN,Pack Size,Segment,URL,Image URL,Brand,Price  €,Parent Level Sales,ASIN Sales,ASIN Revenue,Title Char. Count,BSR,Seller Country/Region,Fees  €,Active Sellers,Ratings,Review Count,Images,Review velocity,Buy Box,Category,Size Tier,Fulfillment,Dimensions,Weight,ABA Most Clicked,Creation Date,Sponsored,Best Seller,Seller Age (mo),Seller,Display Order,Recent Purchases,Parent Level Revenue
"Fruit Fly Trap, Beige, Reusable, Set of 2, Fruit Fly Trap for Kitchen, Permanently Get Rid of Fruit Flies, Fruit Fly Trap, Live Trap, Fly Trap Against Fruit Flies",B0FFBFWX4Y,,Fruit-Bait,https://www.amazon.de/dp/B0FFBFWX4Y?psc=1,https://m.media-amazon.com/images/I/71VWvKUVIjL._AC_SY355_.jpg,Havenhaus,14.99,42,13,200.48,162,"9,230",,5.65,2,4,176,8,4,Nordicshop Onlinehandel GmbH,Garden,Small Parcel,MFN,14.40 x 7.40 x 10.80 cm,0.34,,"Jun 24, 2025",,No,9,Nordicshop Onlinehandel GmbH,50.1.,,562.99
The sustainable fruit fly live trap - suitable for baptismal flies fruit flies vinegar flies - reusable - dishwasher safe - 100% plastic-free - no chemicals (pack of 3),B09DXCZ1JQ,,Fruit-Bait,https://www.amazon.de/dp/B09DXCZ1JQ?psc=1,"https://m.media-amazon.com/images/I/61uCpx0K7uL._AC_SX355_PIbundle-3,TopRight,0,0_SH20_.jpg",frubby,44.39,25,4,173.88,168,"41,215",,273.55,2,4.4,962,9,4,Kaleido.Shop GmbH,Garden,Special Oversize,MFN,9.00 x 7.20 x 7.20 cm,606.01,,"Aug 30, 2021",,No,55,Kaleido.Shop GmbH,47.1.,,488.64
"VEYOFLY Fly Trap, Socket Insect Trap for Indoors, Safer Home, Insect Light for Plug-in, Mosquitoes, Fruit Fly Gnate Protection, Flea Protection, Odourless (4 Devices + 12 Refills)",B0BZTFNK8R,,Electric,https://www.amazon.de/dp/B0BZTFNK8R?psc=1,https://m.media-amazon.com/images/I/71dK5fXjH7L._SX342_.jpg,VEYOFLY,104.86,71,1,168.41,179,"19,962",,19.66,4,4,"3,070",8,46,ABDUL RAHIM YILDIZ,Garden,Standard Parcel,MFN,22.81 x 15.49 x 18.11 cm,1.03,,"Feb 3, 2024",,No,25,ABDUL RAHIM YILDIZ,58.2.,,"2,212.65"
"Fruit Fly Trap, Reusable Glass, Set of 2, Fruit Fly Trap for Kitchen, Permanently Get Rid of Fruit Flies, Fruit Fly Trap, Live Trap, Fly Trap Against Fruit Flies",B0FFBNGTF6,,Fruit-Bait,https://www.amazon.de/dp/B0FFBNGTF6?psc=1,https://m.media-amazon.com/images/I/71OrA68vTvL._AC_SY355_.jpg,Havenhaus,14.99,42,11,167.02,161,"9,228",DE,5.65,2,4,176,8,4,Nordicshop Onlinehandel GmbH,Garden,Small Parcel,MFN,10.50 x 14.20 x 7.40 cm,0.3,,"Jun 25, 2025",,No,9,Nordicshop Onlinehandel GmbH,50,,562.99
"VEYOFLY Refills for Flight Insect Trap, Insect Catcher, Indoor Fly Trap, Safer Home, Fruit Fly Traps, Gnate Protection, Insect Killer, Mosquito Killer (Pack of 15)",B0BHN2YLRR,,Electric,https://www.amazon.de/dp/B0BHN2YLRR?psc=1,https://m.media-amazon.com/images/I/71VdPp6rY1L._AC_SY355_.jpg,VEYOFLY,24.97,90,6,156.21,163,"27,596",,6.79,1,3.4,"12,246",7,117,VEYOFLY DE,Garden,Large Envelope,FBA,15.40 x 3.20 x 9.70 cm,0.13,,"Nov 20, 2024",,No,16,VEYOFLY DE,113.3.,,"2,163.17"
