asin,variant_asin,variant,marketplace,brand,product_title,title,body,rating,date,author,verified_purchase,helpful_votes,review_id,review_url,images,scrape_date
B0BX4GQF68,,Style: 4 Traps,amazon.com,,,They just won't go inside!,Well it does a great job attracting the fruit flies but they don't seem to want to go inside the trap. I'll keep watching to see what happens.,3,"Reviewed in the United States on July 28, 2025",chasn1,True,0,RCCY5PENGB9NN,https://www.amazon.com/gp/customer-reviews/RCCY5PENGB9NN,https://images-na.ssl-images-amazon.com/images/G/01/x-locale/common/grey-pixel.gif; https://m.media-amazon.com/images/I/51bjAjbWyQL._SY88.jpg,2026-03-22T17:27:09.999146
B0BX4GQF68,,Style: 6 Traps,amazon.com,,,Try something else,Suppose to kill fruit flies. Did not work too well.,3,"Reviewed in the United States on September 12, 2025",Mike Wheeler,True,0,R1GAX23R8OYF8H,https://www.amazon.com/gp/customer-reviews/R1GAX23R8OYF8H,,2026-03-22T17:27:09.999146
B0BX4GQF68,,Style: 4 Traps,amazon.com,,,Doesn’t last long,"They work to catch the fruit flies but the liquid dried up after only 2 weeks so the bottles it came with lasted a month, not 6 months.",3,"Reviewed in the United States on July 26, 2025",Tara Sobczak,True,0,R3VYWCKST97KUB,https://www.amazon.com/gp/customer-reviews/R3VYWCKST97KUB,,2026-03-22T17:27:09.999146
B0BX4GQF68,,Style: 4 Traps,amazon.com,,,Maybe...maybe not...,Couldn't tell they did a good job...had fruit flies b4 and after use of product...IDK...,3,"Reviewed in the United States on September 2, 2025",Lou Ann Nedom,True,0,RD5TDNWJJ3W2C,https://www.amazon.com/gp/customer-reviews/RD5TDNWJJ3W2C,,2026-03-22T17:27:09.999146
B0BX4GQF68,,Style: 4 Traps,amazon.com,,,Works but You Better Do The Following Instead,"Since I love the TERRO brand’s ant bait (TERRO T300B Liquid Ant Killer) a lot, I had high expectations, but I was kind of disappointed with this product.Does it work? Yes, some what, but not as effective as I hoped.Here’s a better solution: Pour a couple of ounces of apple cider vinegar into a bottom-flat container (I use an old glass jam jar) and add a bit of dish soap. This works WAY better than the TERRO Fruit Fly Trap. How much better? I caught ~30 flies with the TERRO trap, but the vinegar trap caught 50+!Do I recommend this product? 50/50 - I'd rather just make one myself.",3,"Reviewed in the United States on October 11, 2024",Ray,True,23,R7WLU2F74CQYQ,https://www.amazon.com/gp/customer-reviews/R7WLU2F74CQYQ,,2026-03-22T17:27:09.999146
B0BX4GQF68,,Style: 4 Traps,amazon.com,,,Incomplete product,Received product with a missing cap,3,"Reviewed in the United States on September 14, 2025",Emily Fuller,True,0,R77L5UKW36DLO,https://www.amazon.com/gp/customer-reviews/R77L5UKW36DLO,https://images-na.ssl-images-amazon.com/images/G/01/x-locale/common/grey-pixel.gif; https://m.media-amazon.com/images/I/81ifDnGT66L._SY88.jpg,2026-03-22T17:27:09.999146
B0BX4GQF68,,Style: 4 Traps,amazon.com,,,Effective until Solution Prematurely Evaporates,"I purchased 2 separate packs w 2 traps in each package, but I only received 1 bottle of solution! The instructions specify to use half of the solution for 2 traps so I was forced to accommodate 4 traps. The traps did attract and catch many gnats/fruit flies. Even though I had to spread out the solution, it should not have evaporated in a week, which falls significantly short of what was advertised. I agree with other reviewers about the inability to purchase additional bottles of the solution. So I used a diy solution of vinegar and dish soap in the trap.*Before my diy solution...One day I watched a ghat lingering on the top of the trap. I began to record it with the intention of sharing/posting an actual capture. It would go into the hole, then come back out, over and over again. It was mind-boggling, yet hilarious at the same time! I eventually gave up after stopping and starting the video.  🤷",3,"Reviewed in the United States on September 10, 2023",Nae M,True,3,RQ3CO98EE7OOA,https://www.amazon.com/gp/customer-reviews/RQ3CO98EE7OOA,,2026-03-22T17:27:09.999146
B0BX4GQF68,,Style: 4 Traps,amazon.com,,,"Ok , but better options out there","These did kinda work, had to order the sucking fan opinion to really get the job done",3,"Reviewed in the United States on August 8, 2025",tlane02,True,0,R3LYLD2JE6KJNF,https://www.amazon.com/gp/customer-reviews/R3LYLD2JE6KJNF,,2026-03-22T17:27:09.999146
B0BX4GQF68,,Style: 4 Traps,amazon.com,,,Good not great,They work but it’s annoying to fill them over and over and they do not catch everything.,3,"Reviewed in the United States on July 30, 2025",Amazon Customer,True,0,R264MS4J4W80C1,https://www.amazon.com/gp/customer-reviews/R264MS4J4W80C1,,2026-03-22T17:27:09.999146
B0BX4GQF68,,Style: 4 Traps,amazon.com,,,Didn’t work as hoped,I caught  few small insects but only one fruit fly I really needing to catch more fruit flies in them.,3,"Reviewed in the United States on July 14, 2025",Nelly,True,0,R1QQ4CKMQAD2B3,https://www.amazon.com/gp/customer-reviews/R1QQ4CKMQAD2B3,,2026-03-22T17:27:09.999146
B0BX4GQF68,,Style: 4 Traps,amazon.com,,,Ok but not great,These fruit flies are multiplying like rabbits!!  I’ve had a few f f in the past and they just die off but not these. The traps caught so many but I still have too many. Maybe it’s not the product I just have a different type of fly. I’ve used sprays too but nothing works. I may have to get an exterminator.i only gave 3 stars because I still have the problem. So not a satisfied customer.,3,"Reviewed in the United States on February 16, 2025",Phyllis DiCristofano,True,0,R327HJKK6LY9N9,https://www.amazon.com/gp/customer-reviews/R327HJKK6LY9N9,,2026-03-22T17:27:09.999146
B0BX4GQF68,,Style: 4 Traps,amazon.com,,,Almost helpful,"Works well to attract fruit flies, but after watching for 24hrs no flies have entered into the solution. While flies rest on the surface it’s easy to kill them though",3,"Reviewed in the United States on June 12, 2025",Faith,True,0,RJB9M4BCKDCD1,https://www.amazon.com/gp/customer-reviews/RJB9M4BCKDCD1,,2026-03-22T17:27:09.999146
B0BX4GQF68,,Style: 4 Traps,amazon.com,,,their effectiveness after about 2 weeks,"Kind of embarrassing but this summer we had the worst fruit fly infestation we’ve had. Where it got really bad seemed to be in my 17 year old sons bedroom where he has a whole bunch of apple sauce packets he ate in the trash. These little suckers seem to love anything related to apples. It was bad. We tried apple cider vinaigrette and dish soap, open wine bottles with a little wine in the bottom. Zevo light. EVERYTHING. These are the most effective by far. It is so gross but these have caught so many fruit flies. My only gripe is that the package says to leave them out 45 days. They really seem to lose their effectiveness after about 2 weeks",3,"Reviewed in the United States on April 5, 2024",Amazon Customer,True,24,R1J3I3KX9C8J9C,https://www.amazon.com/gp/customer-reviews/R1J3I3KX9C8J9C,,2026-03-22T17:27:09.999146
B0BX4GQF68,,Style: 4 Traps,amazon.com,,,Refill,Its better if we can refillRest is ok,3,"Reviewed in the United States on August 10, 2025",Maninder Arora,True,0,R11W6XFRCHDC56,https://www.amazon.com/gp/customer-reviews/R11W6XFRCHDC56,,2026-03-22T17:27:09.999146
B0BX4GQF68,,Style: 4 Traps,amazon.com,,,try other products,Why did you pick this product vs others?:Hopeful but doesn't work as well as I hoped,3,"Reviewed in the United States on July 9, 2025",Jewelsbird,True,0,RZ559Q3WVGO2B,https://www.amazon.com/gp/customer-reviews/RZ559Q3WVGO2B,,2026-03-22T17:27:09.999146
B0BX4GQF68,,Style: 4 Traps,amazon.com,,,Sorta does the job,These sort of did the job. They took a while to finally attract the fruit flies that I have. After a few days after that though they didn't attract others. It didn't last the 45 days I believe I read it was supposed to last. I don't want to have to keep replenishing the solution in order to keep the fruit flies away. One thing the product sellers are correct about is making sure you place them someplace out the way. Of course that doesn't coincide with where you actually need them. I knocked mine over several times because they were in the way.,3,"Reviewed in the United States on August 18, 2024",Carolina girl,True,5,R39AWPC2YF371V,https://www.amazon.com/gp/customer-reviews/R39AWPC2YF371V,,2026-03-22T17:27:09.999146
B0BX4GQF68,,Style: 4 Traps,amazon.com,,,Not as good as expected,"The holes are a little small for the flies to fall directly in. I observed that most of the time they are hanging out on the top. Only maybe half actually fell in. Before this, I used a wide cup with vinegar. Works like magic and better money.",3,"Reviewed in the United States on March 31, 2025",Tristan P,True,0,R2RMWTISKPC9WN,https://www.amazon.com/gp/customer-reviews/R2RMWTISKPC9WN,,2026-03-22T17:27:09.999146
B0BX4GQF68,,Style: 4 Traps,amazon.com,,,Not bad,"Not bad at all. Catches a lot of bugs.However It does make a smell.Sometimes I feel like it's catching a lot of bugs, but it's still doesn't catch all of them.But in general, this is the best I found so far.",3,"Reviewed in the United States on April 4, 2025",Zaldy,True,0,R2D0GHUWCVZ1PA,https://www.amazon.com/gp/customer-reviews/R2D0GHUWCVZ1PA,,2026-03-22T17:27:09.999146
B0BX4GQF68,,Style: 6 Traps,amazon.com,,,Easy to use,Takes a while to actually kill the flys most dont even go into the container but ill update a lil longer into the use of the product.,3,"Reviewed in the United States on May 27, 2025",Moesha H,True,0,RV8SXD2TG9RST,https://www.amazon.com/gp/customer-reviews/RV8SXD2TG9RST,,2026-03-22T17:27:09.999146
B0BX4GQF68,,Style: 4 Traps,amazon.com,,,Not happy with this item,Why did you pick this product vs others?:This only work for about a week,3,"Reviewed in the United States on July 5, 2025",John Kay,True,0,R1ZY01NDGWHP75,https://www.amazon.com/gp/customer-reviews/R1ZY01NDGWHP75,,2026-03-22T17:27:09.999146
B0BX4GQF68,,Style: 4 Traps,amazon.com,,,They are tiny tiny tiny apples,"I am torn seems to be attracting them but they are not going in as much as the hanging water trap I had. But those smell so badly eww. I wish these were a bit bigger and more bait in order. I’ve also used sticky hang strips, homemade with apple cider vinegar and drop of dish soap. That worked for a few but it’s like they got smart and know it’s a trap. The thing is I had a rotten banana and didn’t notice it for too long. Cleaned disinfected and washed out garbage cans. They keep showing up everywhere. These do work but if bigger would work much better. I can’t say I would recommend this product until after you have tried the home remedy first. As well find where they’re coming from.",3,"Reviewed in the United States on September 11, 2023",Michelle DAlessandro,True,0,R2B8MIY4RE0VVU,https://www.amazon.com/gp/customer-reviews/R2B8MIY4RE0VVU,,2026-03-22T17:27:09.999146
B0BX4GQF68,,Style: 4 Traps,amazon.com,,,Takes a while but works,"I placed these in  each corner of the 1st floor hoping to finally get rid of a fruit fly problem we have due to a messy roommate. During the 1st week it didn't seem to really be working at all, but I slowly started seeing some flies hang around each and go into the traps. They don't work as fast as you'd hope but they work none the less. It's been a few weeks now and I'm still waiting for the few stragglers to enter the traps and be done.",3,"Reviewed in the United States on October 8, 2024",Amazon Customer,True,0,R25EXI56XPSNBZ,https://www.amazon.com/gp/customer-reviews/R25EXI56XPSNBZ,,2026-03-22T17:27:09.999146
B0BX4GQF68,,Style: 4 Traps,amazon.com,,,It doesn’t work all that great,"I read the reviews and most of them were positive, so I had high hopes I could eliminate the fruit fly problem in my house. However, I’ve had these in various locations around the house and my fruit flies seem to land, walk around, even go inside, just to crawl back out and fly away. Do I have some highly evolved flies?? The only thing it’s been good for, is drawing them out towards the traps, so I can then kill them on my own.",3,"Reviewed in the United States on October 25, 2024",Bernadette Grinols,True,5,R621MFCT1X2TY,https://www.amazon.com/gp/customer-reviews/R621MFCT1X2TY,,2026-03-22T17:27:09.999146
B0BX4GQF68,,Style: 4 Traps,amazon.com,,,Fruit fly trap,Caps of bottles where broken when I opened it!,3,"Reviewed in the United States on July 10, 2025",Iris,True,0,RYI5XFSHUXM7V,https://www.amazon.com/gp/customer-reviews/RYI5XFSHUXM7V,https://images-na.ssl-images-amazon.com/images/G/01/x-locale/common/grey-pixel.gif; https://m.media-amazon.com/images/I/61EIoyixkzL._SY88.jpg,2026-03-22T17:27:09.999146
B0BX4GQF68,,Style: 4 Traps,amazon.com,,,Get a more efficient way,Not very efficient to trap flies,3,"Reviewed in the United States on July 20, 2025",Ravi,True,0,R1FQ2N0I9HQ4WZ,https://www.amazon.com/gp/customer-reviews/R1FQ2N0I9HQ4WZ,,2026-03-22T17:27:09.999146
B0BX4GQF68,,Style: 4 Traps,amazon.com,,,effects,don't see a difference still have nats,3,"Reviewed in the United States on July 16, 2025",Runninghorse,True,0,RJVM61TKEH9DF,https://www.amazon.com/gp/customer-reviews/RJVM61TKEH9DF,,2026-03-22T17:27:09.999146
B0BX4GQF68,,Style: 4 Traps,amazon.com,,,Not great for fruit flys,I tried this and the lulu catch fruit fly catchers and the mosalogic fly insect trap and the katchy bug zapper.  The terro traps work great for ants.  We didn't have any luck with the fruit flys.  The lulucatch fruit fly catchers caught hundreds of flys.  I also tried spraying my plants with Neme oil.  That helped.,3,"Reviewed in the United States on January 20, 2025",Robin,True,3,R2OAA4IQAB181A,https://www.amazon.com/gp/customer-reviews/R2OAA4IQAB181A,,2026-03-22T17:27:09.999146
B0BX4GQF68,,Style: 4 Traps,amazon.com,,,Ok product,These are ok,3,"Reviewed in the United States on July 17, 2025",It is excellent,True,0,R3E181IBUTUINM,https://www.amazon.com/gp/customer-reviews/R3E181IBUTUINM,,2026-03-22T17:27:09.999146
B0BX4GQF68,,Style: 4 Traps,amazon.com,,,It doesn’t work that well,"I gave this a try because the reviews seemed to be a mixed bag. I’d say it all depends on the fruit flies and the area. For some reason, in my bathroom they worked and in the kitchen, not so much. The fruit flies land near it or on top of it as a hang out zone but they don’t go in it and die by the droves like I imagined. I even tried adding cane sugar to the treatment that comes with these. We live in an apartment and believe that the fruit flies are coming from the drain. Still on the lookout for a more effective product.",3,"Reviewed in the United States on December 12, 2023",Taj,True,16,R1Z04D45H4XIOW,https://www.amazon.com/gp/customer-reviews/R1Z04D45H4XIOW,,2026-03-22T17:27:09.999146
B0BX4GQF68,,Style: 6 Traps,amazon.com,,,"They don't seem to TAKE the bait, but just hang out on top of the fake apple.",The traps are not very good at actually trapping the flies. They sort of just lay on top of the trap and sniff the vinegar from above. Maybe reformulate?,3,"Reviewed in the United States on March 17, 2025",Jeff K.,True,0,R1D97URXP2AZH7,https://www.amazon.com/gp/customer-reviews/R1D97URXP2AZH7,,2026-03-22T17:27:09.999146
B0BX4GQF68,,Style: 6 Traps,amazon.com,,,"Works, but bottles leak","Yes, the product is effective, BUT! watch out when you’re adding the liquid into the little apples - the seals on the bottles are bad. All of them leaked - either slowly onto the top of the apple, or sprayed enough to hit me. I wasn’t squeezing hard either—so just be careful as you’re filling the apples up!",3,"Reviewed in the United States on December 19, 2024",Made in Minnesota,True,0,R4P2SPOMIZXUX,https://www.amazon.com/gp/customer-reviews/R4P2SPOMIZXUX,,2026-03-22T17:27:09.999146
B0BX4GQF68,,Style: 4 Traps,amazon.com,,,Seem to work,Seems to be working as number of fruit flies are diminishing but I still see some actually walking on the trap and not going in Not messy and look much better than the sticky traps with the dead bugs all over them Hoping eventually all of them will disappear,3,"Reviewed in the United States on November 2, 2024",Kathleen,True,0,R2HE5GJP1RYO7G,https://www.amazon.com/gp/customer-reviews/R2HE5GJP1RYO7G,,2026-03-22T17:27:09.999146
B0BX4GQF68,,Style: 4 Traps,amazon.com,,,Not great,Caught 2 in a week,3,"Reviewed in the United States on June 5, 2025",Billybob,True,0,R1TYK95G8UYJR7,https://www.amazon.com/gp/customer-reviews/R1TYK95G8UYJR7,,2026-03-22T17:27:09.999146
B0BX4GQF68,,Style: 6 Traps,amazon.com,,,It Worked but Only Lasted 2 Weeks,"These traps were easy to set up and work great at catching fruit flies. Huge downside is, the concentrate you put in them dried out in about 2 weeks and there's no way to buy concentrate refills.  We ended up purchasing a plugin fruit fly trap. The price of the traps is too high for how long they last.",3,"Reviewed in the United States on November 18, 2024",R. Armstrong,True,0,R3OQ47CNJR78UJ,https://www.amazon.com/gp/customer-reviews/R3OQ47CNJR78UJ,,2026-03-22T17:27:09.999146
B0BX4GQF68,,Style: 4 Traps,amazon.com,,,decent trap.,"The product works. The thing is, so does apple cider vinegar, but not as much.  The individuals not catching anything are possibly trying to catch another variant of fly, and not specifically fruit flies. Price decreased as soon as I bought it, so I dropped a star. Note, the flies can get out of the trap and the liquid does evaporate fairly quickly.",4,"Reviewed in the United States on January 21, 2026",kzar,True,0,R1KFOBMV84T7OY,https://www.amazon.com/gp/customer-reviews/R1KFOBMV84T7OY,,2026-03-22T17:27:09.999146
B0BX4GQF68,,Style: 4 Traps,amazon.com,,,"Mostly effective, and for German roach nymphs","These have been somewhat effective. While I have seen less of these pests when I've got this active, I've also seen them literally just hangout on top of the apple. It's like it can see its dead incestuous disgusting family in the goo and it actually takes it as a warning to not proceed. Perhaps I should stop reusing the same trap...Once this stuff runs out, the pests start right back up again. Not as dense as before, but it is noticeable. I'd rather have this than nothing, that's for sure.I wish this came with way more of the liquid. I feel like I have too many apples and not enough liquid. This seller doesn't appear to sell the liquid in bulk, you just have to buy more traps, which is annoying.I also prefer filling it way more than it suggests because if I fill it less, then I have to replace it more frequently. Ergo, providing more of the liquid would be far more useful.This does emit a faint smell, but I've found that it only smells when I'm directly above it.Make sure to tell your guests or family that this thing can spill if you pick it up wrong.I'd ideally rate this maybe 3.5 stars. It works well enough to keep the pests down, but it's not a permanent solution and they don't always fall for the trap.Update: I've changed my mind. Solid 4 stars. I noticed German roach nymphs wading dead in the liquid. I've been keeping these near my sink because that's where the fruit flies hang out. It appears as though the roaches, while trying to get a drink in the sink, find the fruit fly trap and want in. I have a small infestation of roaches in my place, so if they don't fall for one trap, I'm glad they'll fall for another. I don't like having roach traps on my counter due to the chemicals used, so this much-less-poisonous-to-humans trap is a great alternative.",4,"Reviewed in the United States on August 1, 2025",Willow D,True,40,R1K0QA8NM524W4,https://www.amazon.com/gp/customer-reviews/R1K0QA8NM524W4,,2026-03-22T17:27:09.999146
B0BX4GQF68,,Style: 4 Traps,amazon.com,,,"Effective, but issues with duration","These traps do work. I set them out in within days they were filling up with flies. I found them especially helpful for pinpointing where the flies might be coming from by looking at the amount of captured flies over time in each room. You don’t need to use dish soap for the lure to drown them. I can confirm the lure is safe, I spilled some on myself and besides my shirt smelling like vinegar, it’s completely fine. However, I did fine that the lure evaporated in one of my traps much earlier than the stated time frame (45 days). It caught a lot of flies, but it only lasted maybe a couple weeks.",4,"Reviewed in the United States on February 6, 2026",Andrew J,True,0,R326QX1RNGZI7L,https://www.amazon.com/gp/customer-reviews/R326QX1RNGZI7L,,2026-03-22T17:27:09.999146
B0BX4GQF68,,Style: 4 Traps,amazon.com,,,Very good product. Beats sticky paper.,"I compost  kitchen waste, but it generally takes a good while to fill up the can as I do far less food prep than I used to. I guess the fruit flies and little gnats are coming in with my fresh groceries. I have been using flypaper for years. Decided to try this product, mainly because of the TERRO brand, which I've used for decades when there's an ant invasion. The only minus is the small amount of liquid for the price. No cleanup. Bugs go in, they don't come out.",4,"Reviewed in the United States on February 19, 2026",Mia V,True,0,R1BJUU8VSUSUYM,https://www.amazon.com/gp/customer-reviews/R1BJUU8VSUSUYM,,2026-03-22T17:27:09.999146
B0BX4GQF68,,Style: 4 Traps,amazon.com,,,"Great mixture, potent, but works!","I usually mix up a combination of vinegar and dish soap. This helps a lot with the fruit flies, but these things work even better. The mixture is potent if you spill it, but these things are easy if you first turn them upside down while pointing the mixture to the air. Then flip it - helps keep you from losing any and also from smelling like it all day. These flies can’t help themselves and these will definitely get rid of your problem better than anything else!",4,"Reviewed in the United States on February 12, 2026",Nicole G.,True,0,RAWUCKZPH5UM1,https://www.amazon.com/gp/customer-reviews/RAWUCKZPH5UM1,,2026-03-22T17:27:09.999146
B0BX4GQF68,,Style: 4 Traps,amazon.com,,,No complaints,Used them outside and worked well for about 4 days.,4,"Reviewed in the United States on March 19, 2026",Mike,True,0,R2YVZ6L6E0JR1P,https://www.amazon.com/gp/customer-reviews/R2YVZ6L6E0JR1P,,2026-03-22T17:27:09.999146
B0BX4GQF68,,Style: 4 Traps,amazon.com,,,Good but dried out quickly,Really good for around the kitchen to kill fruit flies but I feel like the liquid dries out very fast,4,"Reviewed in the United States on March 6, 2026",Mi,True,0,R3VLPB9J1HOU4N,https://www.amazon.com/gp/customer-reviews/R3VLPB9J1HOU4N,,2026-03-22T17:27:09.999146
B0BX4GQF68,,Style: 4 Traps,amazon.com,,,Good,It worked just not as quickly as I would have liked,4,"Reviewed in the United States on March 10, 2026",Luann,True,0,R1ZAKY3TCJKI5K,https://www.amazon.com/gp/customer-reviews/R1ZAKY3TCJKI5K,,2026-03-22T17:27:09.999146
B0BX4GQF68,,Style: 4 Traps,amazon.com,,,Gets the job done,"Works really well at catching flies and other insects attracted to fruit. Good value for what you pay for, but wish there was more of the substance used to trap the flies.",4,"Reviewed in the United States on February 19, 2026",Zachary Harrison,True,0,R1LOXMW871SYAM,https://www.amazon.com/gp/customer-reviews/R1LOXMW871SYAM,,2026-03-22T17:27:09.999146
B0BX4GQF68,,Style: 4 Traps,amazon.com,,,Good trap but could be better,"Ok, so do these trap some fruit flies? Yes, I would say they do a decent job. But if I’m being real, these cute, little apple contraptions are more about the aesthetics than being useful for their purpose. I bought the multipack and set out a couple of them - you just pour in the liquid, secure it, and wait. I’ve always made my own fruit fly traps because they’re easy and very effective. However, they’re just not attractive sitting on the counter. I came across these little red traps and I figured this would solve the problem. Anyway, I have found that they do trap flies, but not as efficient as my home-made ones. For the most part, they just look better sitting on top of the counter. Perhaps it’s the included liquid for the trap that doesn’t do a great job of luring the flies in. If I unfortunately have a fruit fly problem again, I will experiment and see if it makes a difference with my own liquid concoction put inside. So, in all I wouldn’t say this product was a waste of money. It works, but there’s definitely room for improvement.",4,"Reviewed in the United States on November 29, 2025",KatH,True,4,R1329MU06ADEBH,https://www.amazon.com/gp/customer-reviews/R1329MU06ADEBH,,2026-03-22T17:27:09.999146
B0BX4GQF68,,Style: 4 Traps,amazon.com,,,Apple cider vinegar to refill!,You can use apple cider vinegar to refill btw. They DO EVENTUALLY get the gnats but you definitely have to do your due diligence by pouring boiling water or white vinegar down the drain to kill the eggs. Otherwise they just come back,4,"Reviewed in the United States on February 5, 2026",B B,True,0,R2XIW5LBBQ3LK0,https://www.amazon.com/gp/customer-reviews/R2XIW5LBBQ3LK0,,2026-03-22T17:27:09.999146
